ticker,fund_name
SOXX,iShares Semiconductor ETF
SOXY,Tidal Trust II YieldMax Target
SPAM,Themes Cybersecurity ETF
SPRX,Spear Alpha ETF
SPTE,SP Funds Trust SP Funds S&P Glo
TAN,Invesco Solar ETF
TDIV,First Trust NASDAQ Technology D
TDV,ProShares S&P Technology Divide
TDVI,FT Vest Technology Dividend Tar
TECB,iShares U.S. Tech Breakthrough
TECL,Direxion Technology Bull 3X Sha
TEK,BlackRock ETF Trust iShares Tec
THNQ,ROBO Global Artificial Intellig
TINY,ProShares Nanotechnology ETF
TRFK,Pacer Funds Pacer Data and Digi
TRFM,ETF Series Solutions AAM Transf
TTEQ,T. Rowe Price Technology ETF
TYLG,Global X Funds Global X Informa
UCYB,ProShares Ultra Nasdaq Cybersec
USD,ProShares Ultra Semiconductors
USRD,Themes US R&D Champions ETF
VERS,ProShares Trust ProShares Metav
VGT,Vanguard Information Tech ETF
WCBR,WisdomTree Cybersecurity Fund
WCLD,WisdomTree Cloud Computing Fund
WFH,Direxion Work From Home ETF
WISE,Themes Generative Artificial In
WTAI,WisdomTree Trust WisdomTree Art
WUGI,AXS Esoterica NextG Economy ETF
XAIX,Xtrackers Artificial Intelligen
XDAT,Franklin Exponential Data ETF
XITK,SPDR FactSet Innovative Technol
XLK,SPDR Select Sector Fund - Techn
XNTK,SPDR NYSE Technology ETF
XPND,First Trust Expanded Technology
XSD,SPDR S&P Semiconductor ETF
XSW,SPDR S&P Software & Services ET
XT,iShares Exponential Technologie
XTL,SPDR S&P Telecom ETF
RCWBX,American Funds Capital World Bond R2
CCWFX,American Funds Capital World Bond Fund
RCEBX,American Funds Capital World Bond R2E
WFBFX,American Funds Capital World Bond F3
WBFFX,American Funds Capital World Bond F1
CWBCX,American Funds Capital World Bond C
CCWEX,American Funds Capital World Bond Fund
BFWFX,American Funds Capital World Bond Fund
FCWBX,American Funds Capital World Bond 529-F2
RCWCX,American Funds Capital World Bond R3
RCWEX,American Funds Capital World Bond R4
RCWHX,American Funds Capital World Bond R5E
CCWCX,American Funds Capital World Bond Fund
CWBFX,American Funds Capital World Bond A
RCWFX,American Funds Capital World Bond R5
RCWAX,American Funds Capital World Bond R1
CCWAX,American Funds Capital World Bond Fund
RCWGX,American Funds Capital World Bond R6
FWBCX,American Funds Capital World Bond 529-F3
CRDOX,Six Circles Credit Opportunities
GIOSX,Guggenheim Macro Opportunities R6
GIOIX,Guggenheim Macro Opportunities Instl
GIOCX,Guggenheim Macro Opportunities C
GIOAX,Guggenheim Macro Opportunities A
GIOPX,Guggenheim Macro Opportunities P
MEDGX,MFS Emerging Markets Debt R4
MEDAX,MFS Emerging Markets Debt A
MEDHX,MFS Emerging Markets Debt R6
MEDFX,MFS Emerging Markets Debt R3
MEDEX,MFS Emerging Markets Debt R2
MEDBX,MFS Emerging Markets Debt B
MEDCX,MFS Emerging Markets Debt C
MEDIX,MFS Emerging Markets Debt I
MEDDX,MFS Emerging Markets Debt R1
TRKZX,T. Rowe Price High Yield Z
PRHIX,T. Rowe Price High Yield I
PRHYX,T. Rowe Price High Yield
PAHIX,T. Rowe Price High Yield Adv
VMIAX,Vanguard Materials Index Admiral
BBMHX,Bridge Builder Municipal High-Income Bond Fund
PTYIX,T. Rowe Price Tax Free High Yield I
PATFX,T. Rowe Price Tax-Free High Yield Adv
PRFHX,T. Rowe Price Tax-Free High Yield
FEGOX,First Eagle Gold C
FEURX,First Eagle Gold R6
FEGIX,First Eagle Gold I
SGGDX,First Eagle Gold A
ERABX,Eaton Vance Total Return Bond R6
EIBAX,Eaton Vance Total Return Bond I
ECBAX,Eaton Vance Total Return Bond C
EBABX,Eaton Vance Total Return Bond Fund
PFRIX,PGIM Floating Rate Income Fund
FRFCX,PGIM Floating Rate Income C
FRFAX,PGIM Floating Rate Income A
FRFZX,PGIM Floating Rate Income Z
0P0000TISB,Pender Corporate Bond A
0P0000TISC,Pender Corporate Bond F
0P0001HZWM,Pender Corporate Bond I
0P0001HZWL,Pender Corporate Bond H
OGMYX,Invesco Gold & Special Minerals Y
OGMIX,Invesco Gold & Special Minerals R6
OGMNX,Invesco Gold & Special Minerals R
OPGSX,Invesco Gold & Special Minerals A
OGMCX,Invesco Gold & Special Minerals C
IOGYX,Invesco Gold & Special Minerals R5
MHICX,MFS High Income C
MHIBX,MFS High Income B
MIHRX,MFS High Income R2
MHIHX,MFS High Income R3
MHIGX,MFS High Income R1
MHIJX,MFS High Income R4
MHITX,MFS High Income A
MHIIX,MFS High Income I
MHIKX,MFS High Income R6
TRHYX,T. Rowe Price Instl High Yield
FIJDX,Fidelity Advisor Gold Z
FGDTX,Fidelity Advisor Gold M
FGDCX,Fidelity Advisor Gold C
FGDIX,Fidelity Advisor Gold I
FGDAX,Fidelity Advisor Gold A
FSAGX,Fidelity Select Gold
ISHSX,Invesco Short Duration High Yld Muni R6
ISHYX,Invesco Short Duration High Yld Muni Y
ISHFX,Invesco Short Duration High Yld Muni R5
ISHCX,Invesco Short Duration High Yld Muni C
ISHAX,Invesco Short Duration High Yld Muni A
FGPMX,Franklin Gold and Precious Metals R6
FRGOX,Franklin Gold and Precious Metals C
FKRCX,Franklin Gold and Precious Metals A
FGADX,Franklin Gold and Precious Metals Adv
CSOAX,Credit Suisse Strategic Income A
CSOIX,Credit Suisse Strategic Income I
CSOCX,Credit Suisse Strategic Income C
SGDLX,Sprott Gold Equity Investor
SGDIX,Sprott Gold Equity Institutional
HWHZX,Hotchkis & Wiley High Yield Z
HWHAX,Hotchkis & Wiley High Yield A
HWHIX,Hotchkis & Wiley High Yield I
RHYAX,RBC BlueBay High Yield Bond A
RGHYX,RBC BlueBay High Yield Bond I
AGGWX,American Century Global Gold R
BGEIX,American Century Global Gold Fund
AGYCX,American Century Global Gold C
AGGNX,American Century Global Gold I
ACGGX,American Century Global Gold A
FMFCX,Fidelity Advisor Materials C
FMFEX,Fidelity Advisor Materials I
FMFTX,Fidelity Advisor Materials M
FMFAX,Fidelity Advisor Materials A
FIJFX,Fidelity Advisor Materials Z
FSDPX,Fidelity Select Materials
IIGCX,VanEck International Investors Gold C
INIIX,VanEck International Investors Gold I
INIYX,VanEck International Investors Gold Y
INIVX,VanEck International Investors Gold A
PTHYX,Putnam Tax-Free High Yield B
PTCCX,Putnam Tax-Free High Yield C
PTFYX,Putnam Tax-Free High Yield Y
PTHAX,Putnam Tax-Free High Yield A
PTFRX,Putnam Tax Free High Yield R6
UIPMX,Victory Precious Metals and Minerals Fund
USAGX,Victory Precious Metals and Minerals Fund
UPMMX,Victory Precious Metals and Minerals Fund
FSCHX,Fidelity Select Chemicals
EKWDX,Allspring Precious Metals Fund
EKWCX,Allspring Precious Metals Fund
EKWAX,Allspring Precious Metals Fund
EKWYX,Allspring Precious Metals Fund
GLDCX,Gabelli Gold C
GLDAX,Gabelli Gold A
GLDIX,Gabelli Gold I
GOLDX,Gabelli Gold AAA
TEIMX,T. Rowe Price Emerg Mkts Lcl Ccy Bd I
PRELX,T. Rowe Price Emerg Mkts Lcl Ccy Bd
TRZFX,T. Rowe Price Emerg Mkts Lcl Ccy Bd Z
PAELX,T. Rowe Price Emerg Mkts Lcl Ccy Bd Adv
EPGIX,EuroPac Gold Fund
EPGFX,EuroPac Gold Fund
APFPX,Artisan Global Unconstrained Fund Investor Shares
APDPX,Artisan Global Unconstrained Fund Advisor Shares
APHPX,Artisan Global Unconstrained Fund
0P0001N8UY,Mackenzie Precious Metals F
0P0001N8UH,Mackenzie Precious Metals PW
0P0001N8UG,Mackenzie Precious Metals D
0P0001N8UX,Mackenzie Precious Metals A
HSTRX,Hussman Strategic Total Return
PFSIX,PIMCO Emerging Markets Full Spectrum Bond Fund
0P0001OCY7,Ninepoint Silver Equities F
0P0001AMJA,JNL/Mellon Materials Sect I
0P0001AMJ9,JNL/Mellon Materials Sect A
JABUX,JHancock Opportunistic Fixed Inc R6
JABTX,JHancock Opportunistic Fixed Inc I
JABOX,JHancock Opportunistic Fixed Inc C
JIGDX,JHancock Opportunistic Fixed Inc 1
JABWX,JHancock Opportunistic Fixed Inc A
USERX,U.S. Global Investors Gold & Precious Metals Fund
IOSSX,Voya Global Bond Port S
IOSAX,Voya Global Bond Port A
IOSIX,Voya Global Bond Port I
0P0001PYYI,Pender Bond Universe Class F USD
OCMGX,OCM Gold Investor
OCMAX,OCM Gold Atlas
RYZCX,Rydex Precious Metals C
RYMPX,Rydex Precious Metals H
RYMNX,Rydex Precious Metals A
RYPMX,Rydex Precious Metals Inv
PEMIX,PIMCO Emerging Markets Corporate Bond Fund
VCIFX,VALIC Company I International Govt Bond Fund
EPBIX,EuroPac International Bond Fund
EPIBX,EuroPac International Bond Fund
0P00016IK7,Rezco Global Flexible A USD
0P0000SCVX,-
0P0001ADXY,CI Gold Corporate Class O
0P0000SCVW,CI Gold Corporate Class A
0P0000Y1ID,CI Gold Corporate Class E
UNWPX,U.S. Global Investors World Precious Minerals Fund
LCDFX,Lord Abbett Emerging Markets Corp Dbt F
LCDVX,Lord Abbett Emerging Markets Corp Dbt R6
LEDCX,Lord Abbett Emerging Markets Corporate Debt Fund
LCDRX,Lord Abbett Emerging Markets Corp Dbt R3
LCDAX,Lord Abbett Emerging Markets Corp Dbt A
LCDOX,Lord Abbett Emerging Markets Corp Dbt F3
LCDIX,Lord Abbett Emerging Markets Corp Dbt I
LCDSX,Lord Abbett Emerging Markets Corp Dbt R4
LCDTX,Lord Abbett Emerging Markets Corp Dbt R5
PSPFX,US Global Investors Global Res
0P0001J43H,Manulife GF Global Resources I3 Acc
0P0001J42E,Manulife GF Global Resources AA Acc
0P00008YCZ,Manulife GF Global Resources AA
0P00008VY4,Craton Capital Precious Metal B
0P00000Y8S,Craton Capital Precious Metal A
0P00013K6U,Craton Capital Precious Metal I
0P0001628C,Craton Capital Precious Metal D
0P0000RYYX,Craton Capital Precious Metal E
0P00013K6T,Craton Capital Precious Metal R
PMPSX,ProFunds Precious Metals UltraSector Svc
PMPIX,ProFunds Precious Metals UltraSector Inv
HFZTX,Hartford Schroders EmMkts Mlt-Sect Bd R5
SMSNX,Hartford Schroders EmMkts Mlt-Sect Bd I
HFZYX,Hartford Schroders EmMkts Mlt-Sect Bd Y
NHCCX,Nuveen High Yield Municipal Bond C
NHMAX,Nuveen High Yield Municipal Bond A
NHMFX,Nuveen High Yield Municipal Bond R6
NHMRX,Nuveen High Yield Municipal Bond I
FSMUX,Strategic Advisers Municipal Bond
BPTRX,Baron Partners Retail
BPTIX,Baron Partners Institutional
BPTUX,Baron Partners R6
VCDAX,Vanguard Consumer Discretionary Fund
MIMIX,MFS Municipal Income I
MMIDX,MFS Municipal Income A1
MPMNX,MFS Municipal Income R6
MMIBX,MFS Municipal Income B
MMICX,MFS Municipal Income C
MMIGX,MFS Municipal Income B1
MFIAX,MFS Municipal Income A
WAPSX,Western Asset Core Plus Bond IS
LWCPX,Western Asset Core Plus Bond Fund
WAPRX,Western Asset Core Plus Bond R
WAPAX,Western Asset Core Plus Bond A
WACIX,Western Asset Core Plus Bond FI
WAPCX,Western Asset Core Plus Bond C
WACPX,Western Asset Core Plus Bond I
MMHKX,MFS Municipal High Income R6
MMHCX,MFS Municipal High Income C
MMIIX,MFS Municipal High Income I
MMHYX,MFS Municipal High Income A
MMHBX,MFS Municipal High Income B
PICYX,Pioneer Bond Y
PBFRX,Pioneer Bond R
PCYBX,Pioneer Bond Fund
PIOBX,Pioneer Bond A
PBFKX,Pioneer Bond K
FSRPX,Fidelity Select Retailing
EASDX,Eaton Vance Short Duration Government Income Fund
EILDX,Eaton Vance Short Duration Gov Inc I
EALDX,Eaton Vance Short Duration Government Income Fund
ECLDX,Eaton Vance Short Duration Government Income Fund
IHIFX,Macquarie High Income Fund Class R6
WRHIX,Macquarie High Income Fund Class C
WHIAX,Macquarie High Income Fund Class A
WHIYX,Macquarie High Income Fund Class Y
IYHIX,Macquarie High Income Fund Class R
IVHIX,Macquarie High Income Fund Class I
IORAX,Invesco AMT-Free Municipal Inc R6
OPTAX,Invesco AMT-Free Municipal Inc A
OMFCX,Invesco AMT-Free Municipal Inc C
OMFYX,Invesco AMT-Free Municipal Inc Y
PEBIX,PIMCO Emerging Markets Bond Fund
PAEMX,PIMCO Emerging Markets Bond A
PEMPX,PIMCO Emerging Markets Bond Fund
PEBCX,PIMCO Emerging Markets Bond Fund
PEBNX,PIMCO Emerging Markets Bond Fund
0P00003EHR,JNL/Mellon Consumer Discretionary Sect I
0P00003CBJ,JNL/Mellon Consumer Discretionary Sect A
TFBVX,T. Rowe Price Virginia Tax Free Bond I
PRVAX,T. Rowe Price Virginia Tax Free Bond
JSIRX,JPMorgan Unconstrained Debt R5
JSIMX,JPMorgan Unconstrained Debt R6
JSIAX,JPMorgan Unconstrained Debt A
JINCX,JPMorgan Unconstrained Debt C
JSISX,JPMorgan Unconstrained Debt I
JISZX,JPMorgan Unconstrained Debt R2
HFLIX,Hartford Floating Rate I
HFLSX,Hartford Floating Rate R4
HFLCX,Hartford Floating Rate C
HFLAX,Hartford Floating Rate A
HFLYX,Hartford Floating Rate Y
HFLRX,Hartford Floating Rate R3
HFLTX,Hartford Floating Rate R5
HFLFX,Hartford Floating Rate F
CINCX,Calvert Income I
CINRX,Calvert Income R6
CIFCX,Calvert Income C
CFICX,Calvert Income A
0P0000V9FF,BlueBay Emerging Markets Corp Bd F
0P0000V9FE,BlueBay Emerging Markets Corp Bd D
0P0000V9FC,BlueBay Emerging Markets Corp Bd A
0P0000WN8Y,BlueBay Emerging Markets Corp Bd O
DDFCX,Macquarie Floating Rate C
DDFFX,Macquarie Floating Rate R
DDFAX,Macquarie Floating Rate A
DDFLX,Macquarie Floating Rate Instl
DDFZX,Macquarie Floating Rate R6
FDLSX,Fidelity Select Leisure
CIOZX,Columbia Income Opportunities Inst
CIOYX,Columbia Income Opportunities Inst3
RIOCX,Columbia Income Opportunities C
AIOAX,Columbia Income Opportunities A
CEPRX,Columbia Income Opportunities Inst2
CIODX,Columbia Income Opportunities S
CUBRX,Calvert Flexible Bond Fund Class R6
CUBIX,Calvert Flexible Bond Fund Class I
CUBCX,Calvert Flexible Bond Fund Class C
CUBAX,Calvert Flexible Bond Fund Class A
HYPPX,MFS High Yield Pooled
FSCPX,Fidelity Select Consumer Discret Port
FIJZX,Fidelity Advisor Consumer Discret Z
FCNIX,Fidelity Advisor Consumer Discret I
FCNAX,Fidelity Advisor Consumer Discret A
FACPX,Fidelity Advisor Consumer Discret M
FCECX,Fidelity Advisor Consumer Discretionary Fund
ARMZX,Western Asset Ultra-Short Income A
LWAIX,Western Asset Ultra-Short Income Fund
ARMGX,Western Asset Ultra-Short Income C1
ARMLX,Western Asset Ultra-Short Income IS
SBAYX,Western Asset Ultra-Short Income I
PCCRX,PIMCO Credit Opportunities Bond C
PZCRX,PIMCO Credit Opportunities Bond A
PPCRX,PIMCO Credit Opportunities Bond I-2
PCARX,PIMCO Credit Opportunities Bond Instl
MSVAX,MFS VA Municipal Bond A
MPVOX,MFS VA Municipal Bond R6
MVACX,MFS VA Municipal Bond C
MIVAX,MFS VA Municipal Bond I
MBVAX,MFS Virginia Municipal Bond Fund
TMNAX,Northern Lights Fund Trust III - Counterpoint Tactical Municipal Fund
TMNCX,Northern Lights Fund Trust III - Counterpoint Tactical Municipal Fund
TMNIX,Northern Lights Fund Trust III - Counterpoint Tactical Municipal Fund
0P0000ZLBX,Renaissance U.S. Dollar Corp Bond A
0P0000ZMIR,-
0P00012HLC,-
0P0000ZLBY,Renaissance US Dollar Corp Bond Prem
0P0001HAAN,Renaissance U.S. Dollar Corp Bd Cl O U$
0P0001L27W,Moneda Luxembourg SICAV - Latin America Corporate Credit II
0P0001L27U,Moneda Luxembourg SICAV - Latin America Corporate Credit II
0P0001L27V,Moneda Luxembourg SICAV - Latin America Corporate Credit II
STMKX,Ocean Park Tactical Municipal A
STMYX,Ocean Park Tactical Municipal Special
STMEX,Ocean Park Tactical Municipal Instl
STMNX,Ocean Park Tactical Municipal Investor
STMHX,Ocean Park Tactical Municipal C
SMARX,Brandes Separately Managed Acct Rsrv Tr
0P00015061,SWC (LU) BF Cmtt Glbl Conv GT
0P0001BG2U,SWC (LU) BF Cmtt Glbl Conv NT
0P0001262P,SWC (LU) BF Cmtt Glbl Conv AT
WAURX,Western Asset Total Return Uncons R
WARIX,Western Asset Total Return Uncons FI
WAARX,Western Asset Total Return Uncons I
WAASX,Western Asset Total Return Uncons IS
WAUCX,Western Asset Total Return Uncons C
WAUAX,Western Asset Total Return Uncons A
BCPRX,Brandes Core Plus Fixed Income Fund
BCPAX,Brandes Core Plus Fixed Income Fund
BCPIX,Brandes Core Plus Fixed Income Fund
CFOIX,Calvert Floating-Rate Advantage I
CFORX,Calvert Floating-Rate Advantage R6
CFOAX,Calvert Floating-Rate Advantage A
PSSCX,PIMCO StocksPLUS Short C
PSPLX,PIMCO StocksPLUS Short I2
PSNNX,PIMCO StocksPLUS Short I-3
PSTIX,PIMCO StocksPLUS Short Institutional
PSSAX,PIMCO StocksPLUS Short A
FSAVX,Fidelity Select Automotive Port
CYPIX,ProFunds Consumer Disctnry Ultra Sec Inv
CYPSX,ProFunds Consumer Disctnry Ultra Sec Svc
EMBUX,VanEck Emerging Markets Bond Fund
EMBAX,VanEck Emerging Markets Bond Fund
EMBYX,VanEck Emerging Markets Bond Fund
USLUX,U.S. Global Investors Global Luxury Goods Fund
PGLOX,"T. Rowe Price International Funds, Inc. - T. Rowe Price Global Consumer Fund"
0P0000RVKJ,Brandes Corp Focus Bond Cl F Unhdgd
0P0000A368,Brandes Corp Focus Bond Cl A Unhedge
UGPIX,ProFunds UltraChina
UGPSX,ProFunds UltraChina
0P0000YKPY,BTG SICAV LatinAmerican Corp Dbt I $ Acc
0P0001HONN,BTG SICAV LatinAmerican Corp Dbt O $ Acc
0P0000YKPX,BTG SICAV LatinAmerican Corp Dbt A $ Acc
SHLMX,Virtus Stone Harbor Local Markets I
VSHEX,Virtus Stone Harbor Local Markets A
RYRCX,Rydex Retailing C
RYRAX,Rydex Retailing H
RYRIX,Rydex Retailing Inv
RYRTX,Rydex Retailing A
0P00018Z52,Sedec UCITS Dollar Bonds USD-R
0P0000TORK,ChinaAMC China Growth Fd B USD
0P0000ZTJH,ChinaAMC China Growth Fd I USD Acc
0P0000TORJ,ChinaAMC China Growth Fd A USD
0P0001MQZ0,Invesco Emerging Markets Bond Z USD Acc
0P0001DK2M,Invesco Global High Yield B USD SD
0P0000SXSG,Invesco Emerging Mkt Corp Bd R USD MD
0P0000Y1QA,Muzinich ShortDurationHighYield Fund
0P00018E49,Janus Henderson Flexible Inc E3m USD
0P0000JMUB,BlueBay Funds - BlueBay High Yield ESG Bond Fund I - USD (Perf)
0P00000WAS,PIMCO GIS Em Mkts Bd Inv USD Acc
0P0000VO6L,Muzinich ShortDurationHY HUSD Inc A
0P0000AAYZ,GAM Multistock Luxury Brands Eq USD C
0P00015KF0,Lord Abbett Multi Sector Inc Z USD Inc
0P0001CMTZ,Schelcher Convertible U
0P0001IIG5,Candriam Abs Ret Eq Mkt Netrl V USDH Acc
0P0001S1V6,PIMCO GIS Em Mkts Bd BM Retl USD Decl
0P0001JMKF,ICG Global Loan A USD Acc
0P00019K1R,Maybank Asian Income A (Acc) - USD
0P0000Q65J,Muzinich ShortDurationHY HUSD Acc R
0P0000N548,Templeton Emerging Mkts Bd A(acc)USD
0P0000VTR6,BGF China Bond D2
0P0000NHH0,BlueBay Funds - BlueBay Emerging Market Corporate Bond Fund
0P0001MTQ4,Lord Abbett Multi Sector Inc AM USD Inc
0P0000WDI2,Janus Henderson US Sh Dur Bd Fd I2 USD
0P00017FKX,BlueBay Funds - BlueBay High Yi
WTIBX,Segall Bryant & Hamill Plus Bond Ret
WIPIX,Allspring Core Plus Bond Instl
WIPDX,Allspring Core Plus Bond Admin
WIIBX,Segall Bryant & Hamill Plus Bond Instl
WFIPX,Allspring Core Plus Bond C
WFCPX,Allspring Managed Acct CoreBuilder CP
WCFRX,Virtus Westchester Credit Event Fd A
WCFIX,Virtus Westchester Credit Event Fd I
WATFX,Western Asset Core Bond I
WAPIX,Western Asset Core Bond FI
WACSX,Western Asset Core Bond IS
WABRX,Western Asset Core Bond R
WABCX,Western Asset Core Bond C
WABAX,Western Asset Core Bond A
VWETX,Vanguard Long-Term Investment-Grade Adm
VWESX,Vanguard Long-Term Investment-Grade Inv
VWEHX,Vanguard High-Yield Corporate Inv
VWEAX,Vanguard High-Yield Corporate Adm
VUSFX,Vanguard Ultra-Short-Term Bond Admiral
VUBFX,Vanguard Ultra-Short-Term Bond Investor
VFSUX,Vanguard Short Term Investment Grade Fund
VFSTX,Vanguard Short Term Investment Grade Fund
VFSIX,Vanguard Short Term Investment Grade Fund
VFIDX,Vanguard Intermediate-Term Investment Grade Fund
VFICX,Vanguard Intermediate-Term Investment Grade Fund
VFAIX,Vanguard Financials Index Fund
VCTPX,VALIC Company I Inflation Protected Fund
VARCX,First Trust Merger Arbitrage Cl C
VARBX,First Trust Merger Arbitrage Cl I
VARAX,FirstTrust Merger Arbitrage Cl A
USIBX,USAA Intermediate Term Bond Fund
URIBX,Victory Core Plus Intermediate Bond Fund
UMMGX,Columbia Bond Fund
UMMDX,Columbia Bond Fund - S
UITCX,Victory Core Plus Intermediate Bond Fund
UITBX,Victory Core Plus Intermediate Bond Fund
UIITX,Victory Core Plus Intermediate Bond Fund
TTRBX,Ambrus Core Bond Institutional
TSIDX,T. Rowe Price Short Duration Income I
TSDLX,T. Rowe Price Short Duration Income Inv
TSBZX,T. Rowe Price QM US Bond Index Z
TSBLX,T. Rowe Price QM US Bond Index I
TRZWX,T. Rowe Price Ultra Short-Term Bond Z
TRZOX,T. Rowe Price Short-Term Bond Z
TRZHX,T. Rowe Price Inflation Protected Bond Z
TRTMX,Invesco Core Bond R5
TRSTX,T. Rowe Price Ultra Short-Term Bond I
TRECX,T. Rowe Price Emerging Mkts Corp Bd
TRDZX,T. Rowe Price Dynamic Global Bond Z
TRCDX,T. Rowe Price Dynamic Credit Z
TRBUX,T. Rowe Price Ultra Short-Term Bond
TIIPX,T. Rowe Price Inflation Protected Bond I
THHYX,Toews Tactical Income Fund
TFXIX,Transamerica Bond I
TFSAX,American Beacon Funds - American Beacon Twentyfour Strategic Income Fund
TFIFX,T. Rowe Price Financial Services I
TFGYX,American Beacon Funds - American Beacon Twentyfour Strategic Income Fund
TFGPX,American Beacon Funds - American Beacon Twentyfour Strategic Income Fund
TFGIX,American Beacon Funds - American Beacon Twentyfour Strategic Income Fund
TFGCX,American Beacon Funds - American Beacon Twentyfour Strategic Income Fund
TECIX,T. Rowe Price Emerging Mkts Corp Bd I
TCNBX,Fundvantage Trust - Ambrus Tax-Conscious National Bond Fund
TCCBX,Fundvantage Trust - Ambrus Tax-Conscious California Bond Fund
TBSIX,T. Rowe Price Short-Term Bond I
TAFLX,Transamerica Bond R6
TAADX,Transamerica Bond R
SVARX,Spectrum Low Volatility Investor
STYJX,Allspring Core Plus Bond Fund
STYAX,Allspring Core Plus Bond Fund
STBYX,Invesco Short Term Bond Fund
STBRX,Invesco Short Term Bond Fund
STBCX,Invesco Short Term Bond C
STBAX,Invesco Short Term Bond A
STAYX,SEI Tax-Advantaged Income Y (STET)
SRINX,Columbia Corporate Income Inst
SRIJX,Columbia Corporate Income S
SRBFX,Columbia Total Return Bond Inst
SRBAX,Columbia Total Return Bond S
SQBCX,Saratoga Investment Quality Bond C
SQBAX,Saratoga Investment Quality Bond A
SPGBX,Symmetry Panoramic Global Fixed Inc I
SNIDX,Bernstein Intermediate Duration
SITEX,SEI Emerging Markets Debt F (SIT)
SIIDX,Bernstein Intermediate Duration Instl
SIFIX,SEI International Fixed Income Y (SIT)
SIEDX,SEI Emerging Markets Debt Y (SIT)
SIBPX,Saratoga Investment Quality Bond I
SFSLX,1919 Financial Services Fund
SFPIX,Saratoga Financial Services I
SFPCX,Saratoga Financial Service C
SFPAX,Saratoga Financial Service A
SEIAX,SEI Multi-Asset Real Return A (SIIT)
SEFIX,SEI International Fixed Income F (SIT)
SEDAX,SEI Emerging Markets Debt A (SIIT)
SEATX,SEI Tax-Advantaged Income F (STET)
SBFAX,1919 Financial Services A
RYKIX,Rydex Banking Inv
RYKCX,Rydex Banking C
RYKAX,Rydex Banking H
RYFNX,Rydex Financial Services A
RYFIX,Rydex Financial Services Inv
RYFCX,Rydex Financial Services C
RYFAX,Rydex Financial Services H
RYBKX,Rydex Banking A
RSYYX,Victory High Yield Y
RSYTX,Russell Inv Strategic Bond M
RSHRX,Columbia High Yield Bond Inst2
RSBRX,Russell Inv Strategic Bond R6
RPIEX,T. Rowe Price Dynamic Global Bond Inv
RPIDX,T. Rowe Price Dynamic Credit
RPHYX,RiverPark Short Term High Yield Retail
RPHIX,RiverPark Short Term High Yield Instl
RPFGX,Davis Financial A
RPELX,T. Rowe Price Dynamic Credit I
RPEIX,T. Rowe Price Dynamic Global Bond I
ROBNX,Robinson Tax Advantaged Income Instl
ROBCX,Robinson Tax Advantaged Income C
ROBAX,Robinson Tax Advantaged Income A
RNSIX,RiverNorth Doubleline Strategic Inc I
RNOTX,RiverNorth/Oaktree High Income R
RNHIX,RiverNorth/Oaktree High Income I
RNDLX,RiverNorth Doubleline Strategic Inc R
RMBNX,RMB Mendon Financial Services C
RMBLX,RMB Mendon Financial Services I
RMBKX,RMB Mendon Financial Services A
RHYKX,Victory High Yield R
RHYCX,Victory High Yield C
RGOTX,Russell Investments Opportunistic Credit Fund
RGCYX,Russell Inv Opportunistic Credit Y
RGCSX,Russell Inv Opportunistic Credit S
RGCCX,Russell Inv Opportunistic Credit C
RGCAX,Russell Inv Opportunistic Credit A
RFDAX,Russell Inv Strategic Bond A
RFCYX,Russell Inv Strategic Bond Y
RFCTX,Russell Inv Strategic Bond S
RFCCX,Russell Inv Strategic Bond C
RBNNX,Robinson Opportunistic Income Instl
RBNCX,Robinson Opportunistic Income C
RBNAX,Robinson Opportunistic Income A
QMHRX,AQR Managed Futures Strategy HV R6
QMHNX,AQR Managed Futures Strategy HV N
QMHIX,AQR Managed Futures Strategy HV I
QGMRX,AQR Macro Opportunities R6
QGMNX,AQR Macro Opportunities N
QGMIX,AQR Macro Opportunities I
PWFAX,PACE Global Fixed Income Investments A
PUTPX,PIMCO Low Duration Opportunities I-2
PUTIX,PIMCO Low Duration Opportunities Instl
PUFCX,PGIM Jennison Financial Services C
PUCPX,PIMCO Dynamic Bond I-2
PUBRX,PIMCO Dynamic Bond R
PUBCX,PIMCO Dynamic Bond C
PUBAX,PIMCO Dynamic Bond A
PTCIX,PIMCO Long-Term Credit Bond Instl
PSSRX,PGIM Jennison Financial Services R
PSAIX,PIMCO Global Advantage Strategy Bd Instl
PRWBX,T. Rowe Price Short-Term Bond
PRTNX,PIMCO Real Return A
PRTCX,PIMCO Real Return C
PRRRX,PIMCO Real Return R
PRRIX,PIMCO Real Return Instl
PRNPX,PIMCO Real Return I-3
PRLPX,PIMCO Real Return I2
PRISX,T. Rowe Price Financial Services
PRIPX,T. Rowe Price Inflation Protected Bd
PNIIX,Principal Bond Market Index Instl
PLCPX,PIMCO Long-Term Credit Bond I-2
PISHX,Cohen & Steers Prfrd Secs & Inc SMA Shrs
PGSAX,PIMCO Global Advantage Strategy Bd A
PGNPX,PIMCO Global Bond Opportunities Fund (U.S. Dollar-Hedged)
PGBIX,PIMCO Global Bond Opportunities Fund (U.S. Dollar-Hedged)
PFUUX,PIMCO International Bond Fund (Unhedged)
PFUPX,PIMCO International Bond Fund (Unhedged)
PFUNX,PIMCO International Bond Fund (Unhedged)
PFUIX,PIMCO International Bond Fund (Unhedged)
PFUAX,PIMCO International Bond Fund (Unhedged)
PFSZX,PGIM Jennison Financial Services Fund
PFSQX,PGIM Jennison Financial Services Fund
PFSAX,PGIM Jennison Financial Services Fund
PFRRX,PIMCO International Bond Fund (U.S. Dollar-Hedged)
PFRCX,PIMCO International Bond Fund (Unhedged)
PFRAX,PIMCO International Bond Fund (U.S. Dollar-Hedged)
PFPNX,PIMCO Preferred and Capital Securities Fund
PFORX,PIMCO International Bond Fund (U.S. Dollar-Hedged)
PFONX,PIMCO International Bond Fund (U.S. Dollar-Hedged)
PFOCX,PIMCO International Bond Fund (U.S. Dollar-Hedged)
PFOAX,PIMCO International Bond Fund (U.S. Dollar-Hedged)
PFNUX,PIMCO Dynamic Bond Fund
PFNNX,PIMCO Preferred and Capital Securities Fund
PFIUX,PIMCO Dynamic Bond Fund
PFINX,PIMCO Preferred and Capital Securities Fund
PFCJX,PIMCO Preferred and Capital Securities Fund
PFBPX,PIMCO International Bond Fund (U.S. Dollar-Hedged)
PFANX,PIMCO Preferred and Capital Securities Fund
PDVPX,PIMCO Diversified Income Fund
PDVAX,PIMCO Diversified Income Fund
PDNIX,PIMCO Diversified Income Fund
PDIIX,PIMCO Diversified Income Fund
PDICX,PIMCO Diversified Income Fund
PDHVX,PGIM Emerging Markets Debt Hard Ccy Z
WSHNX,Weitz Short Duration Income Investor
WMRIX,Wilmington Real Asset Institutional
WMMRX,Wilmington Real Asset A
WEFIX,Weitz Short Duration Income Instl
WCPNX,Weitz Core Plus Income Investor
WCPBX,Weitz Core Plus Income Institutional
VRTPX,Vanguard Real Estate II Index
VRREX,Virtus Duff & Phelps Real Estate Secs R6
VRGEX,Virtus Duff & Phelps Glb Rl Estt Secs R6
VREQX,NYLI CBRE Real Estate Class R6
VGSNX,Vanguard Real Estate Index Institutional
VGSLX,Vanguard Real Estate Index Admiral
VGSIX,Vanguard Real Estate Index Investor
VGSCX,Virtus Duff & Phelps Glb Rl Estt Secs C
VGSAX,Virtus Duff & Phelps Glb Rl Estt Secs A
VGRNX,Vanguard Global ex-US Real Est Idx Ins
VGRLX,Vanguard Global ex-US Real Est Idx Adm
VGREX,VALIC Company I Global Real Estate
