ticker,fund_name
VGISX,Virtus Duff & Phelps Glb Rl Estt Secs I
USHYX,Victory High Income Fund
USAIX,Victory Income Fund
URIFX,Victory Income Fund
URHIX,Victory High Income Fund
UINCX,Victory Income Fund
UIINX,Victory Income Fund
UIHIX,Victory High Income Fund
TVRVX,Third Avenue Real Estate Value Fund
TRRSX,Nuveen Real Estate Sec Sel Retire
TRRPX,Nuveen Real Estate Sec Sel Premier
TRREX,T. Rowe Price Real Estate
TRGRX,T. Rowe Price Global Real Estate
TIRRX,T. Rowe Price Real Estate I
TIRHX,Nuveen Real Estate Sec Sel I
TIRGX,T. Rowe Price Global Real Estate I
TIREX,Nuveen Real Estate Sec Sel R6
TGRYX,TCW Global Real Estate N
TGREX,TCW Global Real Estate I
TFSLX,Touchstone Flexible Income Instl
TFAZX,Tactical Investment Series Trust - TFA Tactical Income Fund
TCREX,Nuveen Real Estate Sec Sel A
TARZX,Third Avenue Real Estate Value Z
TAREX,Third Avenue Real Estate Value Instl
SWASX,Schwab Global Real Estate
STMOX,Sterling Capital Real Estate Fund
STMMX,Sterling Capital Real Estate Fund
STMDX,Sterling Capital Real Estate Fund
SREZX,PGIM Select Real Estate Z
SREYX,SEI Real Estate Y (SIMT)
SREQX,PGIM Select Real Estate R6
SRECX,PGIM Select Real Estate C
SREAX,PGIM Select Real Estate A
SOIAX,Spirit of America Real Estate Inc&Gr Ins
SOAAX,Spirit of America Real Estate Inc & Gr A
SIIIX,AlphaCentric Real Income I
SIICX,AlphaCentric Real Income C
SIIAX,AlphaCentric Real Income A
SHYPX,American Beacon SiM High Yld Opps Inv
SHOYX,American Beacon SiM High Yld Opps Y
SHOIX,American Beacon SiM High Yld Opps R5
SHOCX,American Beacon SiM High Yld Opps C
SHOAX,American Beacon SiM High Yld Opps A
SFREX,Schwab Fundamental Global Real Estate Index Fund
SETAX,SEI Institutional Managed Trust Real Estate Fund
SEIRX,SEI Real Estate I (SIMT)
SCREX,MFS Variable Insurance Trust III - MFS Global Real Estate Portfolio
SAREX,SA Real Estate Securities
SACRX,Spirit of America Real Estate Inc&Gr C
RYREX,Rydex Real Estate A
RYHRX,Rydex Real Estate H
RYCRX,Rydex Real Estate C
RSIVX,RiverPark Strategic Income Retail
RSIIX,RiverPark Strategic Income Institutional
RRSRX,Russell Inv Global Real Estate Secs R6
RRSCX,Russell Inv Global Real Estate Secs C
RRRZX,DWS RREEF Real Estate Securities R6
RRRSX,DWS RREEF Real Estate Securities R
RRRRX,DWS RREEF Real Estate Securities Instl
RRREX,DWS RREEF Real Estate Securities S
RRRCX,DWS RREEF Real Estate Securities C
RRRAX,DWS RREEF Real Estate Securities A
RRGTX,DWS RREEF Global Real Estate Secc S
RRGRX,DWS RREEF Global Real Estate Secc R6
RRGIX,DWS RREEF Global Real Estate Secc Inst
RRGCX,DWS RREEF Global Real Estate Secc C
RRGAX,DWS RREEF Global Real Estate Secc A
RREYX,Russell Inv Global Real Estate Secs Y
RRESX,Russell Inv Global Real Estate Secs S
RREAX,Russell Inv Global Real Estate Secs A
RPFRX,Davis Real Estate A
RLCIX,Lazard US High Yield Portfolio R6
RGREX,Invesco Global Real Estate Fund
RETTX,Russell Inv Global Real Estate Secs M
REPSX,ProFunds Real Estate UltraSector Svc
REPIX,ProFunds Real Estate UltraSector Inv
REIZX,Third Avenue International Real Estate Value Fund
REINX,Invesco Real Estate Fund
REIIX,West Loop Realty Fund
REIFX,Third Avenue International Real Estate Value Fund
REICX,West Loop Realty Fund
REIAX,West Loop Realty Fund
REAIX,American Century Real Estate I
REACX,American Century Real Estate Inv
RCTIX,River Canyon Total Return Bond Instl
RAAIX,Altegris/AACA Opportunistic Real Estt I
RAACX,Altegris/AACA Opportunistic Real Estt C
RAAAX,Altegris/AACA Opportunistic Real Estt A
PZRMX,PIMCO Inflation Response Multi-Asst A
PURZX,PGIM Global Real Estate Z
PURRX,PGIM Global Real Estate R
PURGX,PGIM Global Real Estate R4
PUREX,PGIM Global Real Estate R2
PURCX,PGIM Global Real Estate C
PURAX,PGIM Global Real Estate A
PTTRX,PIMCO Total Return Instl
PTTPX,PIMCO Total Return I2
PTTNX,PIMCO Total Return I-3
PTTCX,PIMCO Total Return C
PTTAX,PIMCO Total Return A
PTRRX,PIMCO Total Return R
PTRAX,PIMCO Total Return Admin
PRRAX,Principal Real Estate Securities A
PRKZX,PGIM Real Estate Income Z
PRKQX,PGIM Real Estate Income R6
PRKCX,PGIM Real Estate Income C
PRKAX,PGIM Real Estate Income A
PRERX,Principal Real Estate Securities R3
PREQX,PACE Global Real Estate Securities P
PREPX,Principal Real Estate Securities R5
PREJX,Principal Real Estate Securities J
PREAX,PACE Global Real Estate Securities A
PRCEX,Principal Real Estate Securities C
PPRMX,PIMCO Inflation Response Multi-Asst I2
POSIX,Principal Global Real Estate Sec Instl
POSAX,Principal Global Real Estate Sec A
PMZPX,PIMCO Mortgage Opportunities and Bd I-2
PMZNX,PIMCO Mortgage Opportunities and Bd I-3
PMZIX,PIMCO Mortgage Opportunities and BdInstl
PMZCX,PIMCO Mortgage Opportunities and Bd C
PMZAX,PIMCO Mortgage Opportunities and Bd A
PJEZX,PGIM US Real Estate Z
PJEQX,PGIM US Real Estate R6
PJECX,PGIM US Real Estate C
PJEAX,PGIM US Real Estate A
PIRMX,PIMCO Inflation Response MultiAsst Instl
PIREX,Principal Real Estate Securities Inst
PHRIX,Virtus Duff & Phelps Real Estate Secs I
PHRCX,Virtus Duff & Phelps Real Estate Secs C
PHRAX,Virtus Duff & Phelps Real Estate Secs A
PGRUX,Principal Global Real Estate Sec R5
PGRSX,Principal Global Real Estate Sec R6
PGRQX,PGIM Global Real Estate R6
PGRKX,Principal Global Real Estate Sec R3
PFRSX,Principal Real Estate Securities Fd R6
PFRMX,PIMCO Inflation Response Multi-Asset Fund
PAREX,T. Rowe Price Real Estate Advisor
PAGEX,T. Rowe Price Global Real Estate Adv
OIOIX,AXS Income Opportunities I
OIODX,AXS Income Opportunities D
NRREX,Neuberger Berman Real Estate Fund
NRFYX,Natixis Funds Trust IV AEW Global Focused Real Estate Fund
NRFNX,Natixis AEW Global Focused Real Estate N
NRFAX,Natixis AEW Global Focused Real Estate A
NRERX,Neuberger Berman Real Estate R3
NREEX,Neuberger Berman Real Estate E
NRECX,Neuberger Berman Real Estate C
NREAX,Neuberger Berman Real Estate A
NRCFX,Natixis AEW Global Focused Real Estate C
NMMGX,Northern Multi-Manager Glbl Real Estate
NGREX,Northern Global Real Estate Index
NGJIX,Nuveen Global Real Estate Securities I
NGJFX,Nuveen Global Real Estate Securities R6
NGJCX,Nuveen Global Real Estate Securities C
NGJAX,Nuveen Global Real Estate Securities A
NFIIX,Neuberger Berman Floating Rate Inc I
NFICX,Neuberger Berman Floating Rate Inc C
NFIAX,Neuberger Berman Floating Rate Inc A
NBRIX,Neuberger Berman Real Estate I
NBRFX,Neuberger Berman Real Estate Tr
MXSFX,Empower Real Estate Index Instl
MXREX,Empower Real Estate Index Inv
MXIIX,Touchstone Flexible Income Y
MWSTX,TCW MetWest Strategic Income M
MWSIX,TCW MetWest Strategic Income I
MWFSX,Metropolitan West Funds - Flexible Income Fund
MWFEX,Metropolitan West Funds - Flexible Income Fund
MWCRX,TCW MetWest Unconstrained Bd M
MWCPX,TCW MetWest Unconstrained Bd Plan
MWCIX,TCW MetWest Unconstrained Bd I
MRESX,Cromwell CenterSquare Real Estate Inv
MRASX,Cromwell CenterSquare Real Estate Inst
MNHYX,Manning & Napier High Yield Bond S
MNHAX,Manning & Napier High Yield Bond I
MHYZX,Manning & Napier High Yield Bond Z
MHYWX,Manning & Napier High Yield Bond W
MGLRX,MFS Global Real Estate R6
MGLMX,MFS Global Real Estate R4
MGLLX,MFS Global Real Estate R3
MGLKX,MFS Global Real Estate R2
MGLJX,MFS Global Real Estate R1
MGLIX,MFS Global Real Estate I
VVITX,Voya VACS Series Hyb
VPHYX,Voya High Yield Bond P3
VHYRX,Voya High Yield Bond R6
VCSAX,Vanguard Consumer Staples Fund
SUNBX,Spectrum Unconstrained Investor
RYPDX,Rydex Consumer Products A
RYCPX,Rydex Consumer Products C
RYCIX,Rydex Consumer Products Inv
RYCAX,Rydex Consumer Products H
OSTIX,Osterweis Strategic Income
MSYEX,NYLI MacKay Strategic Bond Class R6
MSYDX,NYLI MacKay Strategic Bond Investor Cl
MSICX,NYLI MacKay Strategic Bond Class C
MSDIX,NYLI MacKay Strategic Bond Class I
MASAX,NYLI MacKay Strategic Bond Class A
IRSTX,Voya High Yield Bond R
IPYSX,Voya High Yield Port S2
IPYAX,Voya High Yield Port A
IPISX,Voya Intermediate Bond Port S
IPIMX,Voya High Yield Port I
IPIIX,Voya Intermediate Bond Port I
IPHYX,Voya High Yield Port S
IMYCX,Voya High Yield Bond C
IIBTX,Voya Intermediate Bond Port S2
IIBPX,Voya Intermediate Bond Port A
IHYWX,Voya High Yield Bond W
IHYPX,Voya High Yield Bond P
IHYIX,Voya High Yield Bond I
IHYAX,Voya High Yield Bond A
HTDRX,Tactical Dividend & Momentum R
HTDIX,Tactical Dividend & Momentum I
HTDCX,Tactical Dividend & Momentum C
HTDAX,Tactical Dividend & Momentum A
FSHNX,Fidelity Series High Income
FIJCX,Fidelity Advisor Consumer Staples Z
FEHRX,First Eagle High Yield Municipal R6
FEHIX,First Eagle High Yield Municipal I
FEHCX,First Eagle High Yield Municipal C
FEHAX,First Eagle High Yield Municipal A
FDTGX,Fidelity Advisor Consumer Staples M
FDIGX,Fidelity Advisor Consumer Staples I
FDFAX,Fidelity Select Consumer Staples Port
FDCGX,Fidelity Advisor Consumer Staples C
FDAGX,Fidelity Advisor Consumer Staples A
DEBTX,Shelton Tactical Credit Investor
DEBIX,Shelton Tactical Credit Institutional
DDJRX,Polen Opportunistic High Yield - Inv
DDJIX,Polen Opportunistic High Yield - Y
DDJCX,Polen Opportunistic High Yield - Ins
COBYX,The Cook & Bynum
CNPSX,Consumer Staples UltraSector ProFund Svc
CNPIX,Consumer Staples UltraSector ProFund Inv
AGDZX,AB High Income Z
AGDYX,AB High Income Advisor
AGDIX,AB High Income I
AGDCX,AB High Income C
AGDAX,AB High Income A
0P0001UDGL,-
0P0001TZTX,Man Hi Yld Opps I USD G-Dist Q H
0P0001TY4P,M&G (Lux) Glb HY Bd L USD Acc
0P0001TK36,-
0P0001TK35,-
0P0001TK34,-
0P0001SQG4,DNCA Invest Alpha Bonds H-WA US
0P0001SOY5,UBS (Lux) BS Global Dyn $ I-A1-
0P0001SIL2,DNCA Invest Alpha Bonds H-WAD U
0P0001RQQK,M&G (Lux) Global High Yield Bon
0P0001QYMF,Man Hi Yld Opps IV USD G-Dis H
0P0001QYME,Man Hi Yld Opps DV USD G-Dis H
0P0001QXTB,BlackRock Strategic Funds - Sustainable Fixed Income Strategies Fund
0P0001Q8X2,DNCA Invest Alpha Bonds H-WI USD
0P0001PO9S,Man Hi Yld Opps IU USD Acc H
0P0001PGLT,M&G (Lux) Sust Mac Flex Crdt WIH USD Acc
0P0001PGLR,M&G (Lux) Sust Mac Flex Crdt WH USD Acc
0P0001PGLP,M&G (Lux) Sust Mac Flex Crdt P2H USD Acc
0P0001OWW5,Man Hi Yld Opps DY H USD Fix-Dist MO
0P0001OV5P,BSF Sustainable FxIncStrats S2USDH
0P0001OBA5,Jupiter Dynamic Bond ESG D USD Acc HSC
0P0001O4FJ,M&G European HY Crdt Invm E USD HInc
0P0001O4FI,M&G European HY Crdt Invm E USD HAcc
0P0001O4FH,M&G European HY Crdt Invm A USD HInc
0P0001O4FG,M&G European HY Crdt Invm A USD HAcc
0P0001O4F4,M&G Total Return Crdt Invmt A USD H Inc
0P0001O030,Man Hi Yld Opps D USD Acc H
0P0001NJST,Man Hi Yld Opps DW USD Acc H
0P0001N3JX,La Franaise Rendement Glb 2028 TD USD H
0P0001N3JW,La Franaise Rendement Glb 2028 RD USD H
0P0001M9QE,Man Hi Yld Opps D USD Net-Dist MO H
0P0001M6AD,White Fleet II - Centrica Global Bond Fund
0P0001LQKJ,IVO Global Opportunities USD - I Cap Hdg
0P0001LMSY,UBS (Lux) BS Global Dyn $ K-B-acc
0P0001LJO6,La Franaise Rendement Glb 2028 IC USD H
0P0001JXCJ,Man Hi Yld Opps IV USD Acc H
0P0001JXCI,Man Hi Yld Opps DV USD Acc H
0P0001JV07,Man Hi Yld Opps I USD Net-Dist MO H
0P0001JFVB,JSS Sustainable Bd Glb Hi Yld Y USD Dis
0P0001JDZK,UBS (Lux) BS Global Dyn $ I-B-acc
0P0001J4E2,BBVA DIF Stable Opportunity A USD
0P0001J444,UBS (Lux) BS Global Dyn $ I-A-acc
0P0001IPBY,BBVA DIF Stable Opportunity P USD
0P0001III5,UBS (Lux) BS Global Dyn $ P-4%-mdist
0P0001IB5F,UBS (Lux) BS Global Dyn $ Q-4%-mdist
0P0001FVBB,DNCA Invest Alpha Bonds HA USD
0P0001FKY7,Man Hi Yld Opps I USD Acc H
0P0001FIH1,JSS Sustainable Bd Glb Hi Yld Y USD Acc
0P0001F3D9,JSS Sust Total Return Global Y USD acc
0P0001ENAU,DNCA Invest Alpha Bonds H-I USD
0P0001E4OQ,UBS (Lux) BS Global Dyn $ K-X acc
0P0001DFJ2,M&G (Lux) Investment Funds 1 - M&G (Lux) Global High Yield Bond Fund
0P0001DFJ0,M&G (Lux) Investment Funds 1 - M&G (Lux) Global High Yield Bond Fund
0P0001DFIX,M&G (Lux) Investment Funds 1 - M&G (Lux) Global High Yield Bond Fund
0P0001DFIV,M&G (Lux) Investment Funds 1 - M&G (Lux) Global High Yield Bond Fund
0P0001DFEM,M&G (Lux) Investment Funds 1 - M&G (Lux) Global High Yield Bond Fund
0P0001DBM6,JSS Investmentfonds II - JSS Sustainable Bond - Global High Yield
0P0001DBM5,JSS Investmentfonds II - JSS Sustainable Bond - Global High Yield
0P0001DBM0,JSS Investmentfonds II - JSS Sustainable Bond - Global High Yield
0P0001DBLZ,JSS Investmentfonds II - JSS Sustainable Bond - Global High Yield
0P0001D17G,Jupiter Emerging Market Debt L USD Inc F
0P0001D17F,Jupiter Emerging MarketDebt C2 USD Inc F
0P0001CZYJ,La Franaise Rendement Glb 2025 RC USD H
0P0001CRIP,Ostrum Fxd Inc Mlt Strats I-NPF/A USD
0P0001CG5B,JSS Sustainable Bond - Total Return Global I USD dist
0P0001CEIX,DWS Invest Euro High Yield Corp USD TFCH
0P0001CEF3,BSF Sustainable FxIncStrats I2USDH
0P0001CE0R,La Franaise Rendement Global 2025
0P0001CDVY,La Franaise Rendement Global 2025
0P0001C8Z5,IVO Emerg Mrts Corp Debt USD I Acc HDG
0P0001C4MU,Auris Euro Rendement R USDH Acc
0P0001BKR1,La Franaise Rendement Glb 2025 D USD H
0P0001BIN3,Ostrum Fxd Inc Mlt Strats SI-NPF/A USD
0P0001AMJ8,JNL/Mellon Consumers Staples Sect I
0P0001AMJ7,JNL/Mellon Consumers Staples Sect A
0P00019VT7,Jupiter Global Fixed Inc L USD Inc F
0P00019VT2,Jupiter Em Mkt Dbt Inc L USD Inc (F)
0P00019C6T,Jupiter Global Fixed Inc C2 USD Inc F
0P00018R0K,JSS Sust Total Return Global C USD Dis
0P00018OMR,JSS Sust Total Return Global Y USD Dis
0P00018J3K,JSS Sust Total Return Global C USD Acc
0P00017BIS,JSS Sust Total Return Global P USD Dis
0P00017BIR,JSS Sust Total Return Global P USD Acc
0P00017BIO,JSS Sust Total Return Global I USD Acc
0P00016HVX,UBS (Lux) BS Global Dyn $ Q-dist
0P00016HVW,UBS (Lux) BS Global Dyn $ Q-acc
0P00015FW7,BSF Sustainable FxIncStrats D3USDH
0P00015D5A,DWS Invest Euro High Yield Corp USD LDMH
0P00015CVK,M&G Total Return Crdt Invmt A USD H Acc
0P000159B4,Franklin Euro High Yield A(Mdis)USD-H1
0P000156ZR,Jupiter Global Fixed Inc N USD Acc
0P000156ZH,Jupiter Global Fixed Inc N USD Inc
0P00014ZD0,UBS (Lux) BS Global Dyn $ I-X-acc
0P00014IFJ,Chelverton Select Consumer Staples A USD
0P00014CGS,Bonafide Global Fish USD
0P00014753,BSF Sustainable FxIncStrats D2USDH
0P00013OUF,DWS Invest Euro High Yield Corp USD LCH
0P00013OUE,DWS Invest Euro High Yield Corp USD FCH
0P00013DC6,Scor ESG Euro High Yield C USD H
0P00012NF7,BSF Sustainable FxIncStrats A4USDH
0P00012NF6,BSF Sustainable FxIncStrats A2USDH
0P0000Z5IB,AGF Floating Rate Income F
0P0000Z5IA,AGF Floating Rate Income
0P0000YXE9,UBS (Lux) BS Global Dyn $ P-dist
0P0000YXE8,UBS (Lux) BS Global Dyn $ P-acc
0P0000V9D3,Jupiter EM Mkt Dbt Inc C USD Acc
0P0000UCA7,Jupiter Em Mkt Dbt Inc L USD Inc
0P0000UC9N,Jupiter EM Mkt Dbt Inc C USD Inc
0P0000SCQH,Jupiter EM Mkt Dbt Inc I USD Acc
0P0000SCQF,Jupiter Em Mkt Dbt Inc L USD Acc
0P0000NQ2C,Franklin Euro High Yield Fund A(Mdis)USD
0P0000K0QO,Jupiter Emerging Market Debt Fund I USD Acc
0P0000K0QD,Jupiter Global Fixed Inc I USD Acc
0P0000K0QC,Jupiter Emerging Market Debt Fund B USD Inc
0P0000K0QB,Jupiter Global Fixed Inc B USD Inc
0P0000JR4C,Jupiter Emerging Market Debt Fund C USD Inc
0P0000AB5D,Jupiter Emerging Market Debt L USD Inc
0P00008FPX,Jupiter Global Fixed Inc C USD Inc
0P00008FPW,Jupiter Global Fixed Inc L USD Inc
0P000013HY,Jupiter Global Fixed Inc B USD Acc
0P00000XYM,Jupiter Emerging Market Debt B USD Acc
0P00000T5F,Jupiter Em Mkts Dbt L USD Acc
0P00000T59,Jupiter Emerging Market Debt C USD Acc
0P00000T4F,Jupiter Global Fixed Inc C USD Acc
0P00000MMB,Jupiter Global Fixed Inc L USD Acc
WESRX,TETON Convertible Securities AAA
WESIX,TETON Convertible Securities I
WEICX,TETON Convertible Securities C
WEIAX,TETON Convertible Securities A
VRSFX,Virtus Newfleet Senior Floating Rate R6
VRHYX,Virtus Newfleet High Yield R6
VMFRX,Virtus Newfleet Multi-Sect Intrmdt Bd R6
VMFIX,Virtus Newfleet Multi-Sect Intrmdt Bd I
VHCIX,Vanguard Health Care Index Admiral
VGHCX,Vanguard Health Care Fund
VGHAX,Vanguard Health Care Fund
VBFRX,Virtus Newfleet Core Plus Bond Fund
THISX,T. Rowe Price Health Sciences I
SWHFX,Schwab Health Care
SUHIX,DWS Health and Wellness Fund
SUHCX,DWS Health and Wellness Fund
SUHAX,DWS Health and Wellness Fund
STIKX,Pioneer Short Term Income Fund
STIIX,Pioneer Short Term Income Fund
STABX,Pioneer Short Term Income A
SMCVX,ALPS/Smith Credit Opportunities Inv
SMCRX,ALPS/Smith Credit Opportunities I
SMCCX,ALPS/Smith Credit Opportunities C
SMCAX,ALPS/Smith Credit Opportunities A
SIHSX,Guggenheim High Yield C
SIHPX,Guggenheim High Yield P
SIHAX,Guggenheim High Yield A
SHYSX,Guggenheim High Yield R6
SHYIX,Guggenheim High Yield Inst
SHSSX,BlackRock Health Sciences Opps Instl
SHSKX,BlackRock Health Sciences Opps K
SHSCX,BlackRock Health Sciences Opps Inv C
SHSAX,BlackRock Health Sciences Opps Inv A
SHPCX,Saratoga Health & Biotechnology C
SHPAX,Saratoga Health & Biotechnology A
SHIYX,Western Asset Short Duration High Inc I
SHISX,BlackRock Health Sciences Opps Svc
SHICX,Western Asset Short Duration High Inc C1
SHIAX,Western Asset Short Duration High Inc A
SCHLX,DWS Health and Wellness S
SBHIX,Saratoga Health & Biotechnology I
SAVYX,Virtus Newfleet Core Plus Bond I
SAVCX,Virtus Newfleet Core Plus Bond C
SAVAX,Virtus Newfleet Core Plus Bond A
RYOIX,Rydex Biotechnology Inv
RYOAX,Rydex Biotechnology H
RYHIX,Rydex Health Care Inv
RYHEX,Rydex Health Care A
RYHCX,Rydex Health Care C
RYHAX,Rydex Health Care H
RYCFX,Rydex Biotechnology C
RYBOX,Rydex Biotechnology A
RPPVX,American Funds Preservation Port R1
RPPGX,American Funds Preservation Port R6
RPPFX,American Funds Preservation Port R5
RPPEX,American Funds Preservation Port R4
RPPCX,American Funds Preservation Port R3
RPPBX,American Funds Preservation Port R2
RPBEX,American Funds Preservation Port R2E
RGMFX,American Funds Preservation Portfolio
RCRYX,Pioneer Active Credit Fund Y
RCRCX,Pioneer Active Credit Fund C
RCRAX,Pioneer Active Credit Fund A
RCGHX,Virtus KAR Health Sciences C
RBFHX,American Funds The Bond Fund of America
RBFGX,American Funds The Bond Fund of America
RBFFX,American Funds The Bond Fund of America
RBFEX,American Funds The Bond Fund of America
RBFCX,American Funds The Bond Fund of America
RBFBX,American Funds The Bond Fund of America
RBFAX,American Funds The Bond Fund of America
RBEBX,American Funds The Bond Fund of America
RAGHX,Virtus KAR Health Sciences A
QGLDX,Gold Bullion Strategy Investor
QGLCX,Gold Bullion Strategy Advisor
PXHIX,Impax High Yield Bond Institutional
PXHAX,Impax High Yield Bond A
PSHYX,Pioneer Short Term Income Y
PSHCX,Pioneer Short Term Income C
PSFRX,Virtus Newfleet Senior Floating Rate A
PSFIX,Virtus Newfleet Senior Floating Rate I
PRHSX,T. Rowe Price Health Sciences
PPVFX,American Funds Preservation Port F1
PPVCX,American Funds Preservation Port C
PPVAX,American Funds Preservation Port A
PPFFX,American Funds Preservation Port F3
PPEFX,American Funds Preservation Port F2
PJHRX,PGIM Jennison Health Sciences R
PHYNX,Penn Capital Opportunistic High Inc Inst
PHSZX,PGIM Jennison Health Sciences Z
PHSYX,Putnam Global Health Care Y
PHSTX,Putnam Global Health Care A
PHSRX,Putnam Global Health Care R
PHSBX,Putnam Global Health Care B
PHPSX,ProFunds Pharmaceuticals UltraSector Svc
PHPIX,ProFunds Pharmaceuticals UltraSector Inv
PHLQX,PGIM Jennison Health Sciences R6
PHLCX,PGIM Jennison Health Sciences C
PHLAX,PGIM Jennison Health Sciences A
PHCIX,Virtus Newfleet High Yield I
PHCHX,Virtus Newfleet High Yield A
PGHCX,Virtus Newfleet High Yield Fund
PGHAX,Putnam Global Health Care Fund
PFSRX,Virtus Newfleet Senior Floating Rate Fund
PDFDX,Perkins Discovery Fund
PCHSX,Putnam Global Health Care C
PAXHX,Impax High Yield Bond Investor
NHFIX,Northern High Yield Fixed Income
NCMFX,Virtus Newfleet Multi-Sect Intrmdt Bd C
NAMFX,Virtus Newfleet Multi-Sect Intrmdt Bd A
MSVOX,"Morgan Stanley Institutional Fund, Inc. - Vitality Portfolio"
MSVMX,"Morgan Stanley Institutional Fund, Inc. - Vitality Portfolio"
MSVEX,"Morgan Stanley Institutional Fund, Inc. - Vitality Portfolio"
MSVDX,"Morgan Stanley Institutional Fund, Inc. - Vitality Portfolio"
MRRRX,MFS Total Return Bond R2
MRBKX,MFS Total Return Bond R6
MRBJX,MFS Total Return Bond R4
MRBIX,MFS Total Return Bond I
MRBHX,MFS Total Return Bond R3
MRBGX,MFS Total Return Bond R1
MRBFX,MFS Total Return Bond A
MRBCX,MFS Total Return Bond C
MRBBX,MFS Total Return Bond B
MIIIX,Praxis Impact Bond I
MIIAX,Praxis Impact Bond A
MFBKX,MFS Corporate Bond R6
MFBJX,MFS Corporate Bond R4
MFBHX,MFS Corporate Bond R3
MFBGX,MFS Corporate Bond R1
MFBFX,MFS Corporate Bond A
MFBCX,MFS Corporate Bond C
MFBBX,MFS Corporate Bond B
MBRRX,MFS Corporate Bond Fund
MBDIX,MFS Corporate Bond Fund
MAHIX,iMGP High Income Instl
LYFIX,AlphaCentric Life Sciences & Hlthcare I
LYFCX,AlphaCentric Life Sciences & Hlthcare C
LYFAX,AlphaCentric Life Sciences & Hlthcare A
LWSRX,Western Asset Short Duration High Income Fund
LWHIX,Western Asset Short Duration High Income Fund
LSYUX,Lord Abbett Short Duration High Yield R6
LSYTX,Lord Abbett Short Duration High Yield R5
LSYSX,Lord Abbett Short Duration High Yield R4
LSYQX,Lord Abbett Short Duration High Yield R3
LSYNX,Lord Abbett Short Duration High Yield F3
LSYIX,Lord Abbett Short Duration High Yield I
LSYFX,Lord Abbett Short Duration High Yield F
LSYCX,Lord Abbett Short Duration High Yield C
LSYAX,Lord Abbett Short Duration High Yield A
LSIGX,Loomis Sayles Investment Grade F/I
LSFYX,Loomis Sayles Sr Floating Rate and F/I Y
LSFNX,Loomis Sayles Sr Floating Rate and F/I N
LSFCX,Loomis Sayles Sr Floating Rate and F/I C
LSFAX,Loomis Sayles Sr Floating Rate and F/I A
LOGSX,Live Oak Health Sciences
LHCVX,Lord Abbett Health Care R6
LHCTX,Lord Abbett Health Care R5
LHCSX,Lord Abbett Health Care R4
LHCQX,Lord Abbett Health Care R3
LHCOX,Lord Abbett Health Care F3
LHCIX,Lord Abbett Health Care I
LHCFX,Lord Abbett Health Care F
LHCCX,Lord Abbett Health Care C
LHCAX,Lord Abbett Health Care A
JNGLX,Janus Henderson Global Life Sciences D
JMUTX,Janus Henderson Multi-Sector Income T
JMUSX,Janus Henderson Multi-Sector Income S
JMUIX,Janus Henderson Multi-Sector Income I
JMUDX,Janus Henderson Multi-Sector Income D
JMUCX,Janus Henderson Multi-Sector Income C
JMUAX,Janus Henderson Multi-Sector Income A
JMTNX,Janus Henderson Multi-Sector Income N
JFNSX,Janus Henderson Global Life Sciences Fund
JFNNX,Janus Henderson Global Life Sciences Fund Class N Shares
JFNIX,Janus Henderson Global Life Sciences Fund
JFNCX,Janus Henderson Global Life Sciences Fund
JFNAX,Janus Henderson Global Life Sciences Fund
JAGLX,Janus Henderson Global Life Sciences T
HYINX,Invesco High Yield Investor
HYIFX,Invesco High Yield R6
HSDYX,Hartford Short Duration Y
HSDVX,Hartford Short Duration R6
HSDTX,Hartford Short Duration R5
HSDSX,Hartford Short Duration R4
HSDRX,Hartford Short Duration R3
HSDIX,Hartford Short Duration I
HSDFX,Hartford Short Duration F
HSDCX,Hartford Short Duration C
HSDAX,Hartford Short Duration A
HLHIX,Virtus KAR Health Sciences Inst
HIAHX,Hartford Healthcare HLS IA
HGHYX,Hartford Healthcare Y
HGHVX,Hartford Healthcare R6
HGHTX,Hartford Healthcare R5
HGHSX,Hartford Healthcare R4
HGHRX,Hartford Healthcare R3
HGHIX,Hartford Healthcare I
HGHFX,Hartford Healthcare F
HGHCX,Hartford Healthcare C
HGHAX,Hartford Healthcare A
WUSTX,Allspring Ultra Short-Term Income C
WUSNX,Allspring Ultra Short-Term Income A2
WUSDX,Allspring Ultra Short-Term Income Adm
WTAIX,Wilmington Municipal Bond Instl
WTABX,Wilmington Municipal Bond A
WSINX,Allspring Income Plus Inst
WSIDX,Allspring Income Plus Admin
WSICX,Allspring Income Plusl C
WSIAX,Allspring Income Plus A
WIORX,Wilshire Income Opportunities Invest
WIOPX,Wilshire Income Opportunities Instl
WFSHX,Allspring Short-Term Bd Pl C
VVJGX,Voya Short Duration High Income C
VVJDX,Voya Short Duration High Income R6
VVJCX,Voya Short Duration High Income I
VVJBX,Voya Short Duration High Income A
VUIAX,Vanguard Utilities Index Adm
VICIX,Victory Investment Grd Convert I
VAADX,Virtus Convertible Fund
UTPSX,ProFunds Utilities UltraSector Fund
UTPIX,ProFunds Utilities UltraSector Fund
TRZCX,T. Rowe Price Corporate Income Z
TRIZX,T. Rowe Price Floating Rate Z
TODCX,Touchstone Active Bond C
TOBYX,Touchstone Active Bond Y
TOBIX,Touchstone Active Bond Institutional
TOBAX,Touchstone Active Bond A
TIUSX,JHancock Investment Grade Bond I
TICCX,T. Rowe Price Corporate Income I
TFAIX,T. Rowe Price Floating Rate I
TCUSX,JHancock Investment Grade Bond C
TAUSX,JHancock Investment Grade Bond A
SWSFX,Northern Ultra-Short Fixed Inc Sb Wl Sk
SSTYX,Allspring Short-Term Bd Pl R6
SSTVX,Allspring Short-Term Bd Pl A
SSHIX,Allspring Short-Term Bd Pl Inst
SOIUX,Spirit of America Utilts Inst
SOCUX,Spirit of America Utilities C
SOAUX,Spirit of America Utilities A
SNTYX,Sit Tax-Free Income Y
SNTIX,Sit Tax-Free Income
SBFMX,Victory Investment Grd Convert Mb
SBFCX,Victory Investment Grd Convert A
SADIX,Allspring Ultra Short-Term Income Inst
SADAX,Allspring Ultra Short-Term Income A
RYUTX,Rydex Utilities A
RYUIX,Rydex Utilities Inv
RYCUX,Rydex Utilities C
RYAUX,Rydex Utilities H
RWSNX,"Two Roads Shared Trust - Redwood Systematic Macro Trend (""SMART"") Fund"
RWSIX,"Two Roads Shared Trust - Redwood Systematic Macro Trend (""SMART"") Fund"
RWMNX,Two Roads Shared Trust - Redwood Managed Municipal Income Fund
RWMIX,Two Roads Shared Trust - Redwood Managed Municipal Income Fund
RSDYX,Victory Low Duration Bond Y
RQIIX,RESQ Strategic Income I
RQIAX,RESQ Strategic Income A
RPOIX,T. Rowe Price Global High Income Bond I
RPIHX,T. Rowe Price Global High Income Bd
RMMBX,Aspiriant Risk-Managed Municipal Bond
RMDUX,American Funds Multi-Sector Income R-6
RMDTX,American Funds Multi-Sector Income R-5
RMDSX,American Funds Multi-Sector Income R-5E
RMDRX,American Funds Multi-Sector Income R-4
RMDQX,American Funds Multi-Sector Income R-3
RMDPX,American Funds Multi-Sector Income R-2E
RMDOX,American Funds Multi-Sector Income R-2
RMDNX,American Funds Multi-Sector Income R-1
RLDCX,Victory Low Duration Bond C
RLDAX,Victory Low Duration Bond A
RGSVX,ClearBridge Global Infrastructure Inc IS
RGIVX,ClearBridge Global Infrastructure Inc I
RGAVX,ClearBridge Global Infrastructure Inc A
PTHIX,BNY Mellon High Yield - C
PTEAX,Principal Tax-Exempt Bond A
PTBCX,Principal Tax-Exempt Bond C
PRVHX,Permanent Portfolio Versatile Bond C
PRVDX,Permanent Portfolio Versatile Bond A
PRVBX,Permanent Portfolio Versatile Bond I
