ticker,fund_name
PRUZX,PGIM Jennison Utility Z
PRUQX,PGIM Jennison Utility R6
PRUAX,PGIM Jennison Utility A
PRPIX,T. Rowe Price Corporate Income
PRFRX,T. Rowe Price Floating Rate
PRFCX,Principal Spectrum Pref&Cptl Scs IncC
PRCCX,Putnam Convertible Securities C
PPSJX,Principal Spectrum Pref&Cptl Scs IncJ
PPSIX,Principal Spectrum Pref&Cptl Scs IncInst
PPSAX,Principal Spectrum Pref&Cptl Scs IncA
PPREX,Principal Spectrum Pref&Cptl Scs IncR6
PPARX,Principal Spectrum Pref&Cptl Scs IncR5
PNARX,Principal Spectrum Pref&Cptl Scs IncR3
PITEX,Principal Tax-Exempt Bond Institutional
PHIKX,Columbia Convertible Securities C
PHEZX,PGIM Global Total Return (USD Hedged) Z
PHEQX,PGIM Global Total Return (USD Hedged) R6
PHECX,PGIM Global Total Return (USD Hedged) C
PHEAX,PGIM Global Total Return (USD Hedged) A
PCVRX,Putnam Convertible Securities Fund
PCUFX,PGIM Jennison Utility Fund
PCONX,Putnam Convertible Securities A
PCNTX,Putnam Convertible Securities R6
PCNIX,Putnam Convertible Securities I
PCNBX,Putnam Convertible Securities B
PCGYX,Putnam Convertible Securities Y
PAIHX,T. Rowe Price Global High Income Bd Adv
PAFRX,T. Rowe Price Floating Rate Adv
PACIX,Columbia Convertible Securities A
OWCIX,Old Westbury Credit Income
NXOHX,Nuveen OH Municipal Bond I
NVHIX,Nuveen Short Duration Hi Yld Muni Bd I
NVHAX,Nuveen Short Duration Hi Yld Muni Bd A
NVCCX,Nuveen Short Duration Hi Yld Muni Bd C
NUVBX,Nuveen Intermediate Duration Muni Bd I
NUSFX,Northern Ultra-Short Fixed Income
NSIOX,Nuveen Strategic Municipal Opportunities Fund
NSCOX,Nuveen Strategic Municipal Opportunities Fund
NSAOX,Nuveen Strategic Municipal Opportunities Fund
NNCCX,Nuveen Intermediate Duration Muni Bd C
NMBAX,Nuveen Intermediate Duration Municipal Bond Fund
NCIDX,Columbia Convertible Securities S
NCIAX,Columbia Convertible Securities Inst
NBPAX,Nuveen PA Municipal Bond I
NALFX,New Alternatives A
NAEFX,New Alternatives Investor
NAAEX,Nuveen Short Term Municipal Bond C
MURRX,MFS Utilities R2
MUCYX,Victory Core Bond Y
MUCRX,Victory Core Bond R6
MUCCX,Victory Core Bond C
MUCAX,Victory Core Bond A
MPSAX,MassMutual Infl-Prot and Inc A
MOFTX,Mercer Opportunistic Fixed Income I
MOFIX,Mercer Opportunistic Fixed Income Y3
MMUKX,MFS Utilities R6
MMUJX,MFS Utilities R4
MMUIX,MFS Utilities I
MMUHX,MFS Utilities R3
MMUGX,MFS Utilities R1
MMUFX,MFS Utilities A
MMUCX,MFS Utilities C
MMUBX,MFS Utilities B
MMODX,-
MMHVX,NYLI MacKay High Yield Muni Bond Inv Cl
MMHIX,NYLI MacKay High Yield Muni Bond Class I
MMHEX,NYLI MacKay High Yield Muni Bond Cl R6
MMHDX,NYLI MacKay High Yield Muni Bond Class C
MMHAX,NYLI MacKay High Yield Muni Bond Class A
MIPZX,MassMutual Infl-Prot and Inc I
MIPYX,MassMutual Infl-Prot and Inc Svc
MIPSX,MassMutual Infl-Prot and Inc R5
MIPRX,MassMutual Infl-Prot and Inc R4
MIPNX,MassMutual Infl-Prot and Inc R3
MIPLX,MassMutual Infl-Prot and Inc Adm
MIAZX,American Funds Multi-Sector Income Fund
MIAYX,American Funds Multi-Sector Income Fund
MIAWX,American Funds Multi-Sector Income Fund
MIAUX,American Funds Multi-Sector Income Fund
MIAQX,American Funds Multi-Sector Income Fund
MDFIX,Matisse Discounted Bond CEF Strat Instl
MCOAX,NYLI MacKay Convertible Class A
MCNVX,NYLI MacKay Convertible Class I
MCINX,NYLI MacKay Convertible Investor Class
MCCVX,NYLI MacKay Convertible Class C
LUBIX,Thrivent Income Fund
LSIIX,Loomis Sayles Investment Grade Bond Y
LOCFX,Lord Abbett Convertible F3
LMAQX,BrandywineGLOBAL Alternative Credit C
LMAPX,BrandywineGLOBAL Alternative Credit A
LMAOX,BrandywineGLOBAL Alternative Credit FI
LMANX,BrandywineGLOBAL Alternative Credit I
LMAMX,BrandywineGLOBAL Alternative Credit IS
LIGRX,Loomis Sayles Investment Grade Bond Fund
LIGAX,Loomis Sayles Investment Grade Bond Fund
LGBNX,Loomis Sayles Investment Grade Bond Fund
LGBCX,Loomis Sayles Investment Grade Bond Fund
LFLSX,BrandywineGLOBAL Flexible Bond IS
LFLIX,BrandywineGLOBAL Flexible Bond I
LFLCX,BrandywineGLOBAL Flexible Bond C
LFLAX,BrandywineGLOBAL Flexible Bond A
LCFYX,Lord Abbett Convertible I
LCFVX,Lord Abbett Convertible R6
LCFTX,Lord Abbett Convertible R5
LCFSX,Lord Abbett Convertible R4
LCFRX,Lord Abbett Convertible R3
LCFPX,Lord Abbett Convertible P
LBIIX,Thrivent Income S
LBHYX,Thrivent High Yield A
LBHIX,Thrivent High Yield S
LBFFX,Lord Abbett Convertible F
LBCQX,Lord Abbett Convertible R2
LACFX,Lord Abbett Convertible A
LACCX,Lord Abbett Convertible C
JYHIX,JHancock High Yield I
JSTIX,JHancock Income I
JSTCX,JHancock Income C
JSNWX,JHancock Income R6
JSNVX,JHancock Income R5
JSNSX,JHancock Income R2
JSNFX,JHancock Income R4
JMADX,JHancock Mgd Acct Shrs Non-IG CorpBdPort
WFHYX,Allspring Short-Term Hi Inc C
WDHYX,Allspring Short-Term Hi Inc Adm
WCPSX,Communication Services UltraSectorProSvc
WCPIX,Communication Services UltraSectorProInv
VTCAX,Vanguard Communication Svcs Idx Admiral
TRAZX,T. Rowe Price Instl Floating Rate Z
TIYRX,Nuveen High Yield A
TIIUX,Morgan Stanley Pathway Core F/ I
TIHYX,Nuveen High Yield R6
TIHWX,Nuveen High Yield W
TIHRX,Nuveen High Yield R
TIHPX,Nuveen High Yield Premier
TIHHX,Nuveen High Yield I
STYIX,Allspring Short-Term High Income Fund
SSTHX,Allspring Short-Term Hi Inc A
SKSRX,DWS Enhanced Commodity Strategy S
SKRRX,DWS Enhanced Commodity Strategy R6
SKNRX,DWS Enhanced Commodity Strategy A
SKIRX,DWS Enhanced Commodity Strategy Inst
SKCRX,DWS Enhanced Commodity Strategy C
SFHIX,Shenkman Capital Floating Rt Hi Inc Inst
SFHFX,Shenkman Capital Floating Rate High Income Fund
SCFZX,Prudential Investment Portfolios 8 - PGIM Securitized Credit Fund
SCFVX,Sterling Capital Funds - Sterling Capital SMID Opportunities Fund
SCFQX,Sterling Capital Funds - Sterling Capital Diversified Income Fund
SCFOX,PGIM Securitized Credit A
RSFYX,Victory Floating Rate Y
RSFMX,Victory Floating Rate Member
RSFLX,Victory Floating Rate A
RSFCX,Victory Floating Rate C
RPIFX,T. Rowe Price Instl Floating Rate
RIWTX,Russell Inv Investment Grade Bond M
RIGRX,Russell Inv Investment Grade Bond R6
RFRFX,Columbia Floating Rate Inst2
RFRCX,Columbia Floating Rate C
RFRAX,Columbia Floating Rate A
RFAYX,Russell Inv Investment Grade Bond Y
RFATX,Russell Inv Investment Grade Bond S
RFACX,Russell Investments Investment Grade Bond Fund
RFAAX,Russell Investments Investment Grade Bond Fund
PWRIX,Donoghue Forlines Tactical Income I
PWRCX,Donoghue Forlines Tactical Income C
PWRAX,Donoghue Forlines Tactical Income A
PUICX,Putnam Income C
PPLZX,DWS Short Duration R6
PPLCX,DWS Short Duration C
PPILX,DWS Short Duration Inst
PPIAX,DWS Short Duration A
PNCYX,Putnam Income Y
PNCMX,Putnam Income M
PNCBX,Putnam Income B
PLFRX,Aristotle Floating Rate Income I
PLFLX,Aristotle Floating Rate Income A
PLFDX,Aristotle Floating Rate Income I-2
PLDCX,PIMCO Low Duration Income C-2
PLBCX,Aristotle Floating Rate Income C
PINHX,Putnam Income R6
PINFX,Putnam Income R5
PINCX,Putnam Income A
PIFRX,Putnam Income R
PGLBX,Putnam Global Income Trust
PGGYX,Putnam Global Income Trust
PGGLX,Putnam Global Income Trust
PGGIX,Putnam Global Income Trust
PGGEX,Putnam Global Income Trust
PGGDX,Putnam Global Income Trust
PGBRX,Putnam Global Income Trust
PFTPX,PIMCO Low Duration Income Fund
PFRZX,Putnam Floating Rate Income Fund
PFRYX,Putnam Floating Rate Income Fund
PFRBX,Putnam Floating Rate Income Fund
PFNIX,PIMCO Low Duration Income Fund
PFNCX,PIMCO Low Duration Income Fund
PFLRX,Putnam Floating Rate Income Fund
PFLLX,Putnam Floating Rate Income Fund
PFIIX,PIMCO Low Duration Income Fund
PFICX,Putnam Floating Rate Income Fund
PFIAX,PIMCO Low Duration Income Fund
PFFRX,T. Rowe Price Institutional Floating Rate Fund
NEHYX,Loomis Sayles High Income Y
NEHCX,Loomis Sayles High Income C
NEFHX,Loomis Sayles High Income A
NCSRX,Nuveen High Yield Income R6
NCOIX,Nuveen High Yield Income I
NCOAX,Nuveen High Yield Income A
NCFCX,Nuveen High Yield Income C
MXZMX,Empower Global Bond Institutional
MXGBX,Empower Global Bond Investor
MSPZX,MassMutual Total Return Bond I
MSPSX,MassMutual Total Return Bond R5
MSPNX,MassMutual Total Return Bond R3
MSPLX,MassMutual Total Return Bond Adm
MSPHX,MassMutual Total Return Bond Svc
MSPGX,MassMutual Total Return Bond R4
MPTRX,MassMutual Total Return Bond A
MOGLX,Gabelli Media Mogul
MLGLX,Gabelli Media Mogul A
LSHNX,Loomis Sayles High Income N
LSBRX,Loomis Sayles Bond Retail
LSBNX,Loomis Sayles Bond N
LSBDX,Loomis Sayles Bond Instl
LRRVX,Lord Abbett Floating Rate R6
LRRTX,Lord Abbett Floating Rate R5
LRRRX,Lord Abbett Floating Rate R3
LRRKX,Lord Abbett Floating Rate R4
LFRRX,Lord Abbett Floating Rate R2
LFROX,Lord Abbett Floating Rate F3
LFRIX,Lord Abbett Floating Rate I
LFRFX,Lord Abbett Floating Rate F
LFRAX,Lord Abbett Floating Rate A
LBFAX,Loomis Sayles Bond Admin
LARCX,Lord Abbett Floating Rate C
JFIRX,John Hancock Funds Floating Rate Income Fund
JFIIX,John Hancock Funds Floating Rate Income Fund
JFIHX,John Hancock Funds Floating Rate Income Fund
JFIGX,John Hancock Funds Floating Rate Income Fund
JFIDX,John Hancock Funds Floating Rate Income Fund
JFIAX,John Hancock Funds Floating Rate Income Fund
IFRWX,Voya Floating Rate W
IFRRX,Voya Floating Rate R
IFRIX,Voya Floating Rate I
IFRCX,Voya Floating Rate C
IFRAX,Voya Floating Rate A
GTTIX,Gabelli Global Content & Connect I
GTCCX,Gabelli Global Content & Connect C
GTCAX,Gabelli Global Content & Connect A
GSFRX,Goldman Sachs High Yield Fl Rate Instl
GGNPX,Goldman Sachs High Yield Fl Rate P
GGBFX,GuideStone Funds Global Bond Investor
GGBEX,GuideStone Funds Global Bond Instl
GFRSX,Goldman Sachs High Yield Fl Rate R6
GFRRX,Goldman Sachs High Yield Fl Rate R
GFRIX,Goldman Sachs High Yield Fl Rate Inv
GFRCX,Goldman Sachs High Yield Fl Rate C
GFRAX,Goldman Sachs High Yield Fl Rate A
GABTX,Gabelli Global Content & Connect AAA
FYHTX,Fidelity Commodity Strategy
FULLX,Federated Hermes Ultrashort Bond R6
FULIX,Federated Hermes Ultrashort Bond IS
FULBX,Federated Hermes Ultrashort Bond Svc
FULAX,Federated Hermes Ultrashort Bond A
FTUTX,Fidelity Advisor Telecommunications M
FTUIX,Fidelity Advisor Telecommunications I
FTUCX,Fidelity Advisor Telecommunications C
FTUAX,Fidelity Advisor Telecommunications A
FSTCX,Fidelity Select Telecommunications Port
FRSAX,Federated Hermes Float Rate Strat Inc A
FIJGX,Fidelity Advisor Telecommunications Z
FHISX,Federated Hermes Sust High Yield Bond IS
FHIIX,Federated Hermes Sust High Yield Bond A
FHICX,Federated Hermes Sust High Yield Bond C
FHBRX,Federated Hermes Sust High Yield Bond R6
FGKMX,Fidelity Advisor Communication ServicesZ
FGJMX,Fidelity Advisor Communication ServicesI
FGHMX,Fidelity Advisor Communication ServicesC
FGEMX,Fidelity Advisor Communication ServicesM
FGDMX,Fidelity Advisor Communication ServicesA
FFRSX,Federated Hermes Float Rate Strat Inc IS
FFRLX,Federated Hermes Float Rate Strat Inc R6
FCSSX,Fidelity Series Commodity Strategy
FBMPX,Fidelity Select Communication Services Portfolio
EVBLX,Eaton Vance Floating Rate A
ESFIX,Ashmore Emerging Markets Short Dur Instl
ESFCX,Ashmore Emerging Markets Short Dur C
ESFAX,Ashmore Emerging Markets Short Dur A
ESBLX,Eaton Vance Floating Rate Fund
EMKIX,Ashmore Emerging Markets Total Return Fund
EMKCX,Ashmore Emerging Markets Total Return Fund
EMKAX,Ashmore Emerging Markets Total Return Fund
EIBLX,Eaton Vance Floating Rate I
ECBLX,Eaton Vance Floating Rate C
EABLX,Eaton Vance Floating Rate Fund
DNAIX,Dunham Long/Short Credit Fund
DFLYX,BNY Mellon Floating Rate Income Y
DFLIX,BNY Mellon Floating Rate Income I
DFLCX,BNY Mellon Floating Rate Income C
DFLAX,BNY Mellon Floating Rate Income A
DCAIX,Dunham Long/Short Credit Fund Class C
DBPIX,DWS Short Duration S
DABMX,BNY Mellon Yield Enhancement Strategy A
DABLX,BNY Mellon Yield Enhancement Strategy C
DABKX,BNY Mellon Yield Enhancement Strategy I
DABJX,BNY Mellon Yield Enhancement Strategy Y
DAAIX,Dunham Long/Short Credit Fund Class A
CSIBX,Calvert Bond A
CSHIX,Credit Suisse Floating Rate Hi Inc Instl
CSDAX,Calvert Short Duration Income A
CSBCX,Calvert Bond C
COMZX,DWS Digital Horizons Inst
COMSX,DWS Digital Horizons S
COMAX,DWS Digital Horizons A
CLDRX,Calvert Core Bond Income R6
CLDIX,Calvert Core Bond I
CLDAX,Calvert Core Bond A
CHICX,Credit Suisse Floating Rate Hi Inc C
CHIAX,Credit Suisse Floating Rate Hi Inc A
CFRZX,Columbia Floating Rate Inst
CFRYX,Columbia Floating Rate Inst3
CFRIX,Catalyst/CIFC Senior Secured Income I
CFRFX,Catalyst/CIFC Senior Secured Income C-1
WWWFX,Kinetics Internet No Load
WWNPX,Kinetics Paradigm No Load
WTLTX,Segall Bryant & Hamill Qua Hi Yld Retail
WILTX,Segall Bryant & Hamill Qua Hi Yld Inst
WIBMX,Wilmington Broad Market Bond Instl
WAYRX,Western Asset High Yield R
WAYCX,Western Asset High Yield C
WAYAX,Western Asset High Yield A
WAHYX,Western Asset High Yield I
WAHSX,Western Asset High Yield IS
WAGIX,Western Asset Income IS
WABMX,Wilmington Broad Market Bond A
VMSSX,Virtus Newfleet Multi-Sector S/T Bd R6
VMSIX,Vanguard Multi-Sector Income Bond Inv
VMSAX,Vanguard Multi-Sector Income Bond Adm
VLPIX,Virtus Duff & Phelps Sel MLP & Engy I
VLPCX,Virtus Duff & Phelps Sel MLP & Engy C
VLPAX,Virtus Duff & Phelps Sel MLP & Engy A
VLDRX,Virtus Newfleet Low Dur Cor Pl Bd R6
VGENX,Vanguard Energy Fund
VGELX,Vanguard Energy Fund
VENAX,Vanguard Energy Index Fund
VCPIX,Vanguard Core-Plus Bond Fund
VCPAX,Vanguard Core-Plus Bond Fund
VCBDX,VALIC Company I Core Bond Fund
VAGIX,Value Line Core Bond Fund
TUNIX,Transamerica Strategic Income I
TUNAX,Transamerica Strategic Income A
TTIFX,Goldman Sachs Tactical Tilt OverlayInstl
TSRSX,Thornburg Strategic Income R6
TSRRX,Thornburg Strategic Income R5
TSRIX,Thornburg Strategic Income R4
TSIRX,Thornburg Strategic Income R3
TSIIX,Thornburg Strategic Income I
TSICX,Thornburg Strategic Income C
TSIAX,Thornburg Strategic Income A
TRNEX,T. Rowe Price New Era I
TREZX,T. Rowe Price Emerging Markets Bond Z
TORTX,Tortoise Energy Infrastructure TR A
TORIX,Tortoise Energy Infrastructure TR Ins
TORCX,Tortoise Energy Infrastructure TR C
TMLPX,Transamerica Energy Infrastructure I
TMLAX,Transamerica Energy Infrastructure A
TMCLX,Transamerica Energy Infrastructure C
TMAYX,Touchstone Funds Group Trust - Touchstone Credit Opportunities Fund
TMARX,Touchstone Funds Group Trust - Touchstone Credit Opportunities Fund
TMACX,Touchstone Funds Group Trust - Touchstone Credit Opportunities Fund
TINIX,Northern Lights Fund Trust III - Acm Tactical Income Fund
THYYX,Touchstone High Yield Y
THYUX,Morgan Stanley Pathway Hi Yld
THYTX,Transamerica High Yield Muni I2
THYIX,Transamerica High Yield Muni I
THYCX,Touchstone High Yield C
THYAX,Touchstone High Yield A
THLIX,Thrivent Short-Term Bond S
THIYX,Touchstone High Yield Institutional
THCYX,Transamerica High Yield Muni C
THAYX,Transamerica High Yield Muni A
TDHIX,Transamerica High Yield Bond I
TARBX,Touchstone Funds Group Trust - Touchstone Credit Opportunities Fund
TAHTX,Transamerica High Yield Bond I3
TAHRX,Transamerica High Yield Bond R
TAHFX,Transamerica High Yield Bond R4
TAHBX,Transamerica High Yield Bond R6
TAEDX,Transamerica Emerging Markets Debt R6
SSIZX,Ocean Park Tactical Core Income A
SSIRX,Ocean Park Tactical Core Income Instl
SSIIX,Ocean Park Tactical Core Income Inv
SSICX,Ocean Park Tactical Core Income C
SRBRX,Federated Hermes Shrt-Interm TR Bd R6
SPUBX,Symmetry Panoramic US Fixed Income I
SPNNX,Invesco SteelPath MLP Income R
SPMWX,Invesco SteelPath MLP Select 40 R
SPMVX,Invesco SteelPath MLP Select 40 R5
SPMQX,Invesco SteelPath MLP Income R5
SPMPX,Invesco SteelPath MLP Alpha Plus R5
SPMJX,Invesco SteelPath MLP Alpha Plus R
SPMHX,Invesco SteelPath MLP Alpha R5
SPMGX,Invesco SteelPath MLP Alpha R
SOAEX,Spirit of America Energy A
SMRPX,Westwood Salient MLP & Engy Infras Ultr
SMLPX,Westwood Salient MLP & Engy Infras Inst
SMFPX,Westwood Salient MLP & Engy Infras C
SMAPX,Westwood Salient MLP & Engy Infras A
SLIYX,SEI Multi-Asset Income Y (SIMT)
SIOAX,SEI Multi-Asset Income F (SIMT)
SFRZX,Virtus Seix Floating Rate High Income Fund
SFRCX,Virtus Seix Floating Rate High Inc C
SFRAX,Virtus Seix Floating Rate High Inc A
SFHYX,Hundredfold Select Alternative Svc
SEPIX,Saratoga Energy & Basic Materials I
SEPCX,Saratoga Energy & Basic Materials C
SDSYX,Western Asset Income I
SDSIX,Western Asset Income C1
SDSAX,Western Asset Income A
SDMZX,PGIM Short Duration Multi-Sector Bond Z
SDMQX,PGIM Short Duration Multi-Sector Bond R6
SDMCX,PGIM Short Duration Multi-Sector Bond C
SDMAX,PGIM Short Duration Multi-Sector Bond A
SBMBX,Saratoga Energy & Basic Materials A
SAMHX,Virtus Seix High Yield I
SAMBX,Virtus Seix Floating Rate High Inc I
SAIEX,Spirit of America Energy Institutional
SACEX,Spirit of America Energy C
RYVIX,Rydex Energy Services Inv
RYVCX,Rydex Energy Services C
RYVAX,Rydex Energy Services H
RYESX,Rydex Energy Services A
RYENX,Rydex Energy A
RYEIX,Rydex Energy Inv
RYECX,Rydex Energy C
RYEAX,Rydex Energy H
RTEHX,American Funds American High-Inc R2E
RSDTX,Russell Inv Short Duration Bond M
RSBYX,Russell Inv Short Duration Bond Y
RSBTX,Russell Inv Short Duration Bond A
RSBCX,Russell Inv Short Duration Bond C
RRFIX,Federated Hermes Inflation Ptctd Sec IS
RRFCX,Federated Hermes Inflation Ptctd Sec C
RRFAX,Federated Hermes Inflation Ptctd Sec A
RMLPX,Recurrent MLP & Infrastructure Class I
RMHYX,Russell Inv Long Duration Bond Y
RMHTX,Russell Inv Long Duration Bond M
RMHSX,Russell Inv Long Duration Bond S
RITHX,American Funds American High-Inc R5E
RITGX,American Funds American High-Inc R6
RITFX,American Funds American High-Inc R5
RITEX,American Funds American High-Inc R4
RITCX,American Funds American High-Inc R3
RITBX,American Funds American High-Inc R2
RITAX,American Funds American High-Inc R1
RIMOX,City National Rochdale Fixed Income Opportunities Fund
RFBSX,Russell Inv Short Duration Bond S
RDBRX,Russell Inv Short Duration Bond R6
RCMFX,Schwartz Value Focused
QMLFX,Quantified Market Leaders Investor
QMLAX,Quantified Market Leaders Advisor
QDIBX,Fisher IIG Fxd Inc for Ret Plns
PZTRX,PGIM Global Total Return Z
PYTRX,Putnam Core Bond Fund Y
PYRLX,Payden High Income Adv
PYILX,Payden Emerging Markets Local Bond SI
PYHRX,Payden High Income
PYELX,Payden Emerging Markets Local Bond Inv
PYCWX,Payden Core Bond Adviser
PYCSX,Payden Core Bond SI
PYCIX,Payden Emerging Markets Corp Bd SI
PYCHX,Payden High Income SI
PYCEX,Payden Emerging Markets Corp Bd Investor
PYCBX,Payden Core Bond
PYARX,Payden Absolute Return Bond Investor
PYAIX,Payden Absolute Return Bond SI
PYABX,Payden Absolute Return Bond Adv
PUCZX,PGIM Strategic Bond Z
PUCQX,PGIM Strategic Bond R6
PUCCX,PGIM Strategic Bond C
PUCAX,PGIM Strategic Bond A
PTRQX,PGIM Total Return Bond R6
PTRNX,Putnam Core Bond Fund A
PTRKX,Putnam Core Bond Fund R
PTRGX,Putnam Core Bond Fund C
PTREX,Putnam Core Bond Fund R6
PTRBX,Putnam Core Bond Fund B
PTIAX,Performance Trust Total Return Bd Inst
PTCOX,Performance Trust Total Return Bd C
PTAOX,Performance Trust Total Return Bd A
PSYPX,Palmer Square Income Plus
PSTPX,Palmer Square Income Plus T
PSTCX,Virtus Newfleet Multi-Sector S/T Bd C
PRXIX,T. Rowe Price Emerging Markets Bond I
PRPZX,PGIM Jennison Energy Infrastructure Z
PRPQX,PGIM Jennison Energy Infrastructure R6
PRPCX,PGIM Jennison Energy Infrastructure C
PRPAX,PGIM Jennison Energy Infrastructure A
PRNEX,T. Rowe Price New Era
PRHCX,PGIM High Yield C
PREMX,T. Rowe Price Emerging Markets Bond
PRBDX,Principal Core Plus Bond A
PNRZX,PGIM Jennison Natural Resources Z
PNRCX,PGIM Jennison Natural Resources C
PMUBX,Penn Mutual AM Strategic Income Fund I
PMSTX,Virtus Newfleet Multi-Sector S/T Bd C1
PMSIX,Principal Core Plus Bond Inst
PJNQX,PGIM Jennison Natural Resources R6
PIOQX,Principal Core Fixed Income R5
PIOOX,Principal Core Fixed Income R3
PIOJX,Principal Core Fixed Income J
PIOIX,Principal Core Fixed Income Instl
PIMSX,Virtus Newfleet Multi-Sector S/T Bd I
PICNX,Principal Core Fixed Income R6
PHYZX,PGIM High Yield Z
PHYUX,Putnam High Yield R6
PHYTX,Principal High Yield Inst
PHYSX,PIA High Yield Institutional
PHYRX,PIMCO High Yield R
PHYQX,PGIM High Yield R6
PHYPX,PACE High Yield P
PHYMX,Putnam High Yield M
PHYLX,Putnam High Yield C
PHYIX,Putnam High Yield A
VINAX,Vanguard Industrials Index Admiral
TYHYX,Pioneer High Yield Fund
TYHRX,Pioneer High Yield Fund
TTRZX,Templeton Global Total Return Adv
TTRCX,Templeton Global Total Return C
TRVZX,T. Rowe Price New Income Z
TRGAX,T. Rowe Price Global Industrials I
TGTRX,Templeton Global Total Return A
TFILX,T. Rowe Price Tax Free Income I
TEDVX,Nuveen Emerging Markets Debt W
TEDTX,Nuveen Emerging Markets Debt Retire
TEDPX,Nuveen Emerging Markets Debt Premier
TEDNX,Nuveen Emerging Markets Debt R6
TEDLX,Nuveen Emerging Markets Debt A
TEDHX,Nuveen Emerging Markets Debt I
TAHYX,Pioneer High Yield A
STRYX,Pioneer Strategic Income Fund
STRKX,Pioneer Strategic Income Fund
STIRX,Pioneer Strategic Income Fund
SSIJX,American Beacon SSI Alternative Inc R5
SEMPX,Medlst MBS Ttl Rtn Inv
SEMOX,Medlst MBS Ttl Rtn A
SEMMX,Medlst MBS Ttl Rtn Inst
RRNIX,T. Rowe Price New Income R
RPGIX,T. Rowe Price Global Industrials
PYICX,Pioneer High Yield C
PSRCX,Pioneer Strategic Income C
PSRAX,Pioneer Strategic Income A
PSCIX,American Beacon SSI Alternative Inc Y
PSCAX,American Beacon SSI Alternative Inc Inv
PRXEX,T. Rowe Price New Income I
PRTAX,T. Rowe Price Tax-Free Income Inv
PRCIX,T. Rowe Price New Income
PLHYX,Aristotle High Yield Bond I-2
PLHIX,Aristotle High Yield Bond I
PLCHX,Aristotle High Yield Bond C
PLAHX,Aristotle High Yield Bond A
PIAMX,PIA High Yield (MACS) Mgd Acct Cmpltn
PATAX,T. Rowe Price Tax-Free Income Adv
PANIX,T. Rowe Price New Income Adv
ORNYX,Invesco Rochester Municipal Opps Y
ORNCX,Invesco Rochester Municipal Opps C
ORNAX,Invesco Rochester Municipal Opps A
OIFIX,Optimum Fixed Income Instl
OCFIX,Optimum Fixed Income C
OAFIX,Optimum Fixed Income A
NWXHX,Nationwide Amundi Strat Inc Instl Svc
NWXGX,Nationwide Amundi Strat Inc R6
NWXEX,Nationwide Amundi Strat Inc A
NSTTX,Neuberger Berman Strategic Income Fund
NSTLX,Neuberger Berman Strategic Income Fund
NSTCX,Neuberger Berman Strategic Income Fund
NSTAX,Neuberger Berman Strategic Income Fund
NRSIX,Neuberger Berman Strategic Income Fund
NMVAX,Nuveen VA Municipal Bond I
NMMDX,Nuveen Maryland Municipal Bond Fund
NMDAX,Nuveen Maryland Municipal Bond Fund
NCHRX,Nuveen CA High Yield Municipal Bond I
NCHAX,Nuveen CA High Yield Municipal Bond A
NAWSX,Nuveen CA High Yield Municipal Bond C
NACCX,Nuveen MD Municipal Bond C
MXFNX,NYLI Floating Rate Investor Class
MXFMX,NYLI Floating Rate SIMPLE Class
MXFIX,NYLI Floating Rate Class I
MXFEX,NYLI Floating Rate Class R6
MXFCX,NYLI Floating Rate Class C
MXFAX,NYLI Floating Rate Class A
MWHYX,TCW MetWest High Yield Bond M
MWHIX,TCW MetWest High Yield Bond I
LMSFX,Federated Hermes Municipal Bond A
LMSCX,Federated Hermes Municipal Bond C
LMFFX,Federated Hermes Municipal Bond F
LMBIX,Federated Hermes Municipal Bond IS
KTXIX,Commerce KS Tax Free Interm Bd
KHYSX,DWS High Income S
KHYQX,DWS High Income Fund
KHYIX,DWS High Income Fund
KHYCX,DWS High Income Fund
KHYAX,DWS High Income Fund
KBIWX,KBI Global Investors Aquarius Instl
IORYX,Invesco Rochester Municipal Opps R6
IORHX,Invesco Rochester Municipal Opps R5
IDPSX,ProFunds Industrial Ultra Sector Svc
IDPIX,ProFunds Industrial Ultra Sector Inv
HOBIX,Holbrook Income I
HOBEX,Holbrook Income Investor
HOBAX,Holbrook Income A
GEOSX,Pear Tree Funds - Pear Tree Essex Environmental Opportunities Fund
GEORX,Pear Tree Essex Environmental Opps R6
FVCCX,Nuveen VA Municipal Bond C
FVATX,Nuveen VA Municipal Bond A
FTTRX,Templeton Global Total Return R6
FSRFX,Fidelity Select Transportation
FSDAX,Fidelity Select Defense & Aerospace
FRRGX,Templeton Global Total Return R
FNMIX,Fidelity New Markets Income
FLYRX,Pioneer Floating Rate Y
FLRCX,Pioneer Floating Rate C
FLOWX,Fidelity Water Sustainability
FLARX,Pioneer Floating Rate A
FIKEX,Fidelity Advisor Industrials Z
FGZMX,Fidelity Advisor New Markets Income I
FGYMX,Fidelity Advisor New Markets Income C
FGWMX,Fidelity Advisor New Markets Income M
FGVMX,Fidelity Advisor New Markets Income A
FGBMX,Fidelity Advisor New Markets Income Z
FEDCX,Fidelity Series Emerging Markets Debt
FCYIX,Fidelity Select Industrials Portfolio
FCLTX,Fidelity Advisor Industrials M
FCLIX,Fidelity Advisor Industrials I
FCLCX,Fidelity Advisor Industrials C
FCLAX,Fidelity Advisor Industrials A
FCFIX,Frost Credit Institutional
FCFBX,Frost Credit Fund
FCFAX,Frost Credit Fund
EZNYX,Eaton Vance NY Municipal Opps C
EXNYX,Eaton Vance NY Municipal Opps A
ENYIX,Eaton Vance New York Municipal Opportunities Fund
ENIAX,SEI Institutional Investments Trust Opportunistic Income Fund
EMOIX,Eaton Vance Municipal Opportunities Fund
EMOCX,Eaton Vance Municipal Opportunities Fund
EMOAX,Eaton Vance Municipal Opportunities Fund
EICAX,Eaton Vance CA Municipal Opportunities I
EEOFX,Pear Tree Essex Environmental Opps Odnry
ECCAX,Eaton Vance CA Municipal Opportunities C
EACAX,Eaton Vance California Municipal Opportunities Fund
DUGRX,Macquarie Strategic Income R
DUGIX,Macquarie Strategic Income I
DUGCX,Macquarie Strategic Income C
DPZRX,Macquarie Diversified Income R6
DPRFX,Macquarie Diversified Income R
DPFFX,Macquarie Diversified Income Instl
DPDFX,Macquarie Diversified Income A
DPCFX,Macquarie Diversified Income C
DEGGX,Macquarie Strategic Income A
DEDIX,Macquarie Emerging Markets Debt Corp Ins
DEDCX,Macquarie Emerging Markets Debt Corp C
DEDAX,Macquarie Emerging Markets Debt Corp A
CYBRX,Calvert High Yield Bond R6
CYBIX,Calvert High Yield Bond I
CYBAX,Calvert High Yield Bond A
CHBCX,Calvert High Yield Bond C
CFNLX,Commerce Natl Tax Free Interm Bd
CFMOX,Commerce MO Tax-Free Int Bd
AWTIX,Virtus Duff & Phelps Water Inst
AWTCX,Virtus Duff & Phelps Water C
AWTAX,Virtus Duff & Phelps Water A
ANAZX,AB Global Bond Z
ANAYX,AB Global Bond Advisor
ANAIX,AB Global Bond I
ANAGX,AB Global Bond A
ANACX,AB Global Bond C
0P0001UTBJ,Amundi Fds Pio Glb HY Bd A2 USD MD D
0P0001UPOK,-
0P0001UOXO,-
0P0001U9R1,abrdn-Euro High Yield Bond AFxdMIncAHUSD
0P0001TY3N,-
0P0001TIKN,GFI Select Value C USD Acc
0P0001TGWD,GFI Select Value A USD Inc
0P0001T8QH,Algebris UCITS Funds plc - Alge
0P0001T7IB,Impax EM Corporate Bond USD X Acc Hdgd
0P0001SS7Q,Lemanik SICAV Spring Cap Retail USD
0P0001SR0P,Edentree Green Future A USD Acc
